,show_id,type,title,director,cast,country,date_added,release_year,duration,description,genre
0,s1,TV Show,3%,,"João Miguel, Bianca Comparato, Michel Gomes, Rodolfo Valente, Vaneza Oliveira, Rafael Lozano, Viviane Porto, Mel Fronckowiak, Sergio Mamberti, Zezé Motta, Celso Frateschi",Brazil,"August 14, 2020",2020,4,"In a future where the elite inhabit an island paradise far from the crowded slums, you get one chance to join the 3% saved from squalor.",International TV
5,s6,TV Show,46,Serdar Akar,"Erdal Beşikçioğlu, Yasemin Allen, Melis Birkan, Saygın Soysal, Berkan Şal, Metin Belgin, Ayça Eren, Selin Uludoğan, Özay Fecht, Suna Yıldızoğlu",Turkey,"July 1, 2017",2016,1,"A genetics professor experiments with a treatment for his comatose sister that blends medical and shamanic cures, but unlocks a shocking side effect.",International TV
11,s12,TV Show,1983,,"Robert Więckiewicz, Maciej Musiał, Michalina Olszańska, Andrzej Chyra, Clive Russell, Zofia Wichłacz, Edyta Olszówka, Mateusz Kościukiewicz, Ewa Błaszczyk, Vu Le Hong, Tomasz Włosok, Krzysztof Wach",Poland,"November 30, 2018",2018,1,"In this dark alt-history thriller, a naïve law student and a world-weary detective uncover a conspiracy that has tyrannized Poland for decades.",Crime TV
12,s13,TV Show,1994,Diego Enrique Osorno,,Mexico,"May 17, 2019",2019,1,"Archival video and new interviews examine Mexican politics in 1994, a year marked by the rise of the EZLN and the assassination of Luis Donaldo Colosio.",Crime TV
16,s17,TV Show,Feb-09,,"Shahd El Yaseen, Shaila Sabt, Hala, Hanadi Al-Kandari, Salma Salem, Ibrahim Al-Harbi, Mahmoud Boushahri, Yousef Al Balushi, Ghorour, Abdullah Al-bloshi",,"March 20, 2019",2018,1,"As a psychology professor faces Alzheimer's, his daughter and her three close female friends experience romance, marriage, heartbreak and tragedy.",International TV
24,s25,TV Show,​SAINT SEIYA: Knights of the Zodiac,,"Bryson Baugus, Emily Neves, Blake Shepard, Patrick Poole, Luci Christian, Adam Gibbs, Masakazu Morita, Fumiko Orikasa, Takahiro Sakurai, Hiroaki Miura, Satomi Sato, Katsuyuki Konishi",Japan,"January 23, 2020",2020,2,"Seiya and the Knights of the Zodiac rise again to protect the reincarnation of the goddess Athena, but a dark prophecy hangs over them all.",Anime Series
26,s27,TV Show,(Un)Well,,,United States,"August 12, 2020",2020,1,"This docuseries takes a deep dive into the lucrative wellness industry, which touts health and healing. But do the products live up to the promises?",Reality TV
29,s30,TV Show,#blackAF,,"Kenya Barris, Rashida Jones, Iman Benson, Genneya Walton, Scarlet Spencer, Justin Claiborne, Ravi Cabot-Conyers",United States,"April 17, 2020",2020,1,"Kenya Barris and his family navigate relationships, race and culture while grappling with their newfound success in this comedy series.",TV Comedies
38,s39,TV Show,แผนร้ายนายเจ้าเล่ห์,,"Chutavuth Pattarakampol, Sheranut Yusananda, Nichaphat Chatchaipholrat, Thassapak Hsu",,"March 30, 2019",2016,1,"When two brothers fall for two sisters, they quickly realize the age differences between them are too big to ignore.",International TV
45,s46,TV Show,Şubat,,"Alican Yücesoy, Melisa Sözen, Musa Uzunlar, Serkan Ercan, Özkan Uğur, Ülkü Duru, Tansu Biçer, Nadir Sarıbacak, Sermet Yeşil, Ayhan Kavas",Turkey,"January 17, 2017",2013,1,"An orphan subjected to tests that gave him superpowers is rescued and raised on Istanbul's streets, where he falls for a reporter linked to his past.",Crime TV
51,s52,TV Show,100 Days My Prince,,"Doh Kyung-soo, Nam Ji-hyun, Cho Seong-ha, Cho Han-cheul, Kim Seon-ho, Han So-hee",South Korea,"December 7, 2020",2018,1,"Upon losing his memory, a crown prince encounters a commoner’s life and experiences unforgettable love as the husband to Joseon’s oldest bachelorette.",International TV
53,s54,TV Show,100 Humans,,"Zainab Johnson, Sammy Obeid, Alie Ward",United States,"March 13, 2020",2020,1,"One hundred hardy souls from diverse backgrounds participate in playful experiments exploring age, sex, happiness and other aspects of being human.",Docuseries
58,s59,TV Show,100% Hotter,,"Daniel Palmer, Melissa Sophia, Karen Williams, Grace Woodward",United Kingdom,"November 1, 2019",2017,1,"A stylist, a hair designer and a makeup artist team up to give Britain's biggest fashion disasters some much-needed makeunders.",British TV
61,s62,TV Show,12 Years Promise,,"So-yeon Lee, Namkoong Min, Tae-im Lee, So-hui Yoon, Won-keun Lee, Hyo-young Ryu",South Korea,"May 22, 2017",2014,1,"A pregnant teen is forced by her family to leave her boyfriend and assume a new identity in America, but 12 years later, the couple reunites in Korea.",International TV
63,s64,TV Show,13 Reasons Why,,"Dylan Minnette, Katherine Langford, Kate Walsh, Derek Luke, Brian d'Arcy James, Alisha Boe, Christian Navarro, Miles Heizer, Ross Butler, Devin Druid, Michele Selene Ang, Steven Silver, Amy Hargreaves",United States,"June 5, 2020",2020,4,"After a teenage girl's perplexing suicide, a classmate receives a series of tapes that unravel the mystery of her tragic choice.",Crime TV
64,s65,TV Show,13 Reasons Why: Beyond the Reasons,,"Dylan Minnette, Katherine Langford, Kate Walsh, Derek Luke, Alisha Boe, Justin Prentice, Brandon Flynn, Miles Heizer, Christian Navarro, Brian Yorkey, Tom McCarthy, Selena Gomez, Mandy Teefey, Jay Asher, Dr. Rona Hu, Dr. Helen Hsu, Dr. Rebecca Hedrick, Alexis Jones, Elaine Welteroth, Julia Bicknell, Dr. Christine Moutier, Nic Sheff, Carrie Goldberg, Anne Winters, Joy Gorman, Brandon Butler, Marissa Jo Cerar, Susanne Timms",United States,"August 23, 2019",2019,3,"Cast members, writers, producers and mental health professionals discuss some of the difficult issues and themes explored in ""13 Reasons Why.""",Crime TV
80,s81,TV Show,20 Minutes,,"Tuba Büyüküstün, Ilker Aksum, Bülent Emin Yarar, İpek Bilgin, Müjde Uzman, Firat Çelik, Ayten Uncuoglu, Cihat Tamer",Turkey,"August 15, 2017",2013,1,"When his wife is convicted of murder, a horrified family man races to prove her innocence while a dogged investigator sets out to uncover the truth.",Crime TV
85,s86,TV Show,21 Again,,Laura Morgan,United Kingdom,"July 1, 2020",2019,1,"In a social experiment, a group of daughters sends their mothers, disguised as 21-year-olds, into the world to experience life as a member of Gen Z.",British TV
86,s87,TV Show,21 Sarfarosh: Saragarhi 1897,,"Luke Kenny, Mohit Raina, Mukul Dev",India,"December 1, 2018",2018,1,"In one of history's greatest last stands, a battalion of 21 Sikh soldiers fights to defend their outpost from attack by over 10,000 Afghans.",International TV
87,s88,TV Show,21 Thunder,,"Stephanie Bennett, Emmanuel Kabongo, RJ Fetherstonhaugh, Andres Joseph, Kevin Claydon, Conrad Pla, Clark Backo, Ryan Pierce, Eileen Li, Susan Bain, Cristina Rosato, Jonathan Kim, Colm Feore",Canada,"March 1, 2018",2017,1,"Players and coaches for a Montreal soccer team chase dreams of stardom while their personal lives erupt with love, fear, passion and violence.",Crime TV
95,s96,TV Show,28 Moons,,"Jin-sung Yang, Kyu-jong Kim, Tae-hwan Kang, Geummi",South Korea,"June 10, 2017",2016,1,"When her fiancé acts strangely upon receiving a mysterious invitation, a florist sets out to find out the truth behind the tiny scrap of paper.",International TV
108,s109,TV Show,3Below: Tales of Arcadia,,"Tatiana Maslany, Diego Luna, Nick Offerman, Nick Frost, Glenn Close, Alon Aboutboul, Hayley Atwell, Darin De Paul, Andy Garcia, Cheryl Hines, Tom Kenny, Chris Obi, Cole Sand, Frank Welker, Steven Yeun",United States,"July 12, 2019",2019,2,"After crash-landing on Earth, two royal teen aliens on the run struggle to blend in with humans as they evade intergalactic bounty hunters.",Kids
111,s112,TV Show,44 Cats,,"Sarah Natochenny, Suzy Myers, Simona Berman, Erica Schroeder, Marca Leigh, Scottie Ray, Henry F. Benjamin",Italy,"October 1, 2020",2018,2,"Paw-esome tales abound when singing furry friends Lampo, Milady, Pilou and Meatball band together.",Kids
112,s113,TV Show,45 rpm,,"Carlos Cuevas, Guiomar Puerta, Iván Marcos, Israel Elejalde, Eudald Font, Luis Larrodera, Carmen Gutiérrez, Diana Gómez, Vito Sanz, Marina San José, Pere Ponce, Joan Pera",Spain,"August 16, 2019",2019,1,"In 1960s Madrid, music producer Guillermo Rojas launches a rock 'n' roll label with the help of aspiring singer Robert and clever producer Maribel.",International TV
130,s131,TV Show,60 Days In,,,United States,"November 1, 2020",2019,1,"Recruited by a sheriff, volunteers infiltrate county prisons to expose corruption and crime from within the system in this docuseries.",Reality TV
132,s133,TV Show,7 (Seven),Nizar Shafi,"Rahman, Havish, Regina Cassandra, Nandita Swetha, Anisha Ambrose, Tridha Choudhury, Pujitha Ponnada, Aditi Arya",India,"July 30, 2019",2019,1,"Multiple women report their husbands as missing but when it appears they are looking for the same man, a police officer traces their cryptic connection.",TV Shows
134,s135,TV Show,7 Days Out,,,United States,"December 21, 2018",2018,1,"Witness the excitement and drama behind the scenes in the seven days leading up to major live events in the worlds of sports, fashion, space and food.",Docuseries
137,s138,TV Show,72 Cutest Animals,,,Australia,"June 1, 2016",2016,1,This series examines the nature of cuteness and how adorability helps some animal species to survive and thrive in a variety of environments.,Docuseries
138,s139,TV Show,72 Dangerous Animals: Asia,,Bob Brisbane,Australia,"August 10, 2018",2018,1,"From fangs to claws to venomous stings, they all wield deadly weapons. But which creature will be crowned the fiercest of all?",Docuseries
139,s140,TV Show,72 Dangerous Animals: Latin America,,Bob Brisbane,Australia,"December 22, 2017",2017,1,"Powerful cats, indestructible arachnids and flesh-melting pit vipers are just the beginning in this series about Latin America's deadliest creatures.",Docuseries
140,s141,TV Show,72 Dangerous Places to Live,,Mitch Ryan,Australia,"June 1, 2016",2016,1,"Get up close and personal with avalanches, fiery volcanoes and other natural cataclysms, and learn why some choose to live in their destructive paths.",Docuseries
141,s142,TV Show,7SEEDS,,"Nao Toyama, Jun Fukuyama, Katsuyuki Konishi, Yoko Soumi, Kana Asumi, Akira Ishida, Aoi Yuki, Kazuhiko Inoue, Yoko Hikasa, Hirofumi Nojima, Ryotaro Okiayu, Eri Kitamura, Mamiko Noto, Ryo Hirohashi, Shizuka Ito, Hisao Egawa, Mayumi Asano, Kenta Miyake, Ai Kakuma, Kaito Ishikawa, Mikako Komatsu, Daisuke Sakaguchi, Takanori Hoshino, Kenjiro Tsuda, Nozomu Sasaki, Kenji Nojima, Houko Kuwashima, Kensho Ono, Takahiro Sakurai, Haruka Chisuga, Yu Shimamura, Takuma Terashima, Takuya Sato, Junko Minagawa, Masashi Sugawara, Sho Hayami, Kazuyuki Okitsu, Minako Kotobuki",,"March 26, 2020",2020,2,"Shy Natsu awakens as part of a group chosen to ensure the survival of humanity. Together, they have to survive on a changed Earth.",Anime Series
142,s143,TV Show,9 Months That Made You,,Demetri Goritsas,United States,"March 1, 2017",2016,1,"Witness the wonders of human gestation through cutting-edge CGI, and learn how those nine months inside the womb can affect all aspects of one's life.",British TV
152,s153,TV Show,A Boy Name Flora A,,"Crowd Lu, Tsai Chen-nan, Lotus Wang, Fan Chu-Mei, Hsieh Ying-shiuan, Vera Yen, Cammy Chiang",Taiwan,"September 1, 2017",2017,1,A 28-year-old layabout begins to re-examine his life when his dysfunctional family assembles to pay respects to a dying grandmother who won’t pass on.,International TV
180,s181,TV Show,A Good Wife,,"Tien Hsin, Christopher Lee, Darren Chiu, Shara Lin, Blaire Chang, Xi Man-Ning, Chu De-Kang",Taiwan,"January 1, 2017",2013,1,"As her seemingly idyllic life begins to crumble, a lonely woman in a restrictive marriage starts an affair with a gentle bookstore owner.",International TV
188,s189,TV Show,A House of Blocks,,"Eli Shi, Phoebe Lin, Chen Wan-ting, Fan Chen-fei, Lu Hsueh-feng, Figaro Tseng, Winnie Chang, Elten Ting",Taiwan,"September 1, 2017",2017,1,"Yijuan and her mentally ill sister Kaiqi struggle to be happy in the face of misfortune, criminal intrigue, marital strife, an exorcism and a ghost.",International TV
191,s192,TV Show,A Korean Odyssey,,"Lee Seung-gi, Cha Seung-won, Oh Yeon-seo, Lee Hong-gi, Jang Gwang, Lee Se-young",South Korea,"March 5, 2019",2017,1,A self-serving mythical creature's bid for invincibility backfires when he finds himself at the mercy of a woman who can see otherworldly beings.,International TV
195,s196,TV Show,A Lion in the House,"Steven Bognar, Julia Reichert",,United States,"November 10, 2020",2006,1,Five kids and their resilient families navigate the treatments and traumas of pediatric cancer in this documentary filmed over the course of six years.,TV Shows
197,s198,TV Show,A Little Help with Carol Burnett,,"Carol Burnett, Russell Peters, Mark Cuban, Taraji P. Henson, Brittany Snow, Wanda Sykes, Derek Hough, Billy Eichner, Lisa Kudrow, Candace Cameron Bure, DJ Khaled, Tony Hale, Julie Bowen",United States,"May 4, 2018",2018,1,"Comedy icon Carol Burnett returns to TV with a panel of clever kids, who help adults and celebrity guests solve their problems with brutal honesty.",Stand-Up
198,s199,TV Show,A Little Thing Called First Love,,"Lai Kuan-lin, Zhao Jinmai, Wang Runze, Chai Wei, Wang Bowen",China,"October 26, 2019",2019,1,A shy college student with a knack for drawing develops a crush on a musically gifted classmate and embarks on a journey of self-discovery.,International TV
199,s200,TV Show,A Love So Beautiful,,"Kim Yo-han, So Joo-yeon, Yeo Hoi-hyun, Jeong Jin-hwan, Jo Hye-joo, Yun Seo-hyun, Cho Ryun, Kim Sung-gon, Seong Hye-min, Park Ji-won",South Korea,"December 28, 2020",2020,1,"Love is as tough as it is sweet for a lovestruck teenager, whose relationship with her next-door neighbor transforms as they grow into adulthood.",International TV
202,s203,TV Show,A Man Called God,,"Song Il-gook, Han Chae-young, Kim Min-jong, Go Eun Han, Jung Hoon Lee, Nam Da-Reum, Yoo In-young",South Korea,"March 12, 2019",2010,1,"Raised in America, government agent Choi Kang-Ta returns to Korea with the skills of an assassin and a thirst for revenge on his father’s killers.",Crime TV
213,s214,TV Show,A Perfect Crime,,,Germany,"September 25, 2020",2020,1,"This docuseries investigates the 1991 killing of politician Detlev Rohwedder, an unsolved mystery at the heart of Germany's tumultuous reunification.",Crime TV
218,s219,TV Show,A Queen Is Born,Carla Barros,"Gloria Groove, Alexia Twister",Brazil,"November 11, 2020",2020,1,Gloria Groove and Alexia Twister make drag dreams come true as they help six artists find the confidence to own the stage in this makeover show.,International TV
225,s226,TV Show,A Series of Unfortunate Events,,"Neil Patrick Harris, Patrick Warburton, Malina Weissman, Louis Hynes, K. Todd Freeman, Joan Cusack, Aasif Mandvi",United States,"January 1, 2019",2019,3,"The extraordinary Baudelaire orphans face trials, tribulations and the evil Count Olaf in their fateful quest to unlock long-held family secrets.",Kids
235,s236,TV Show,A Taiwanese Tale of Two Cities,,"Tammy Chen, James Wen, Peggy Tseng, Denny Huang",Taiwan,"January 27, 2019",2018,1,"A Taipei doctor and a San Francisco engineer swap homes in a daring pact, embarking on journeys filled with trials, secrets and unexpected encounters.",International TV
239,s240,TV Show,A Thousand Goodnights,,"Cindy Lien, Nicholas Teo, Yao Ai-ning, Li Chung-lin, Chen Bor-jeng, Miao Ke-li",Taiwan,"June 1, 2019",2019,1,"To carry out her dad's wish and discover her roots, Dai Tian-qing embarks on a journey around Taiwan and finds love and redemption on the way.",International TV
241,s242,TV Show,A Touch of Green,,"Weber Yang, Cheryl Yang, Tien Hsin, Gabriel Lan, Wu Kang-jen, Cindy Lien, Wen Chen-ling, Hans Chung",Taiwan,"July 1, 2020",2016,1,"Amid the turmoil of China's civil war, families of Kuomintang pilots face the pain of leaving their homes but find strength in their shared bonds.",International TV
248,s249,TV Show,A Very Secret Service,,"Hugo Becker, Wilfred Benaïche, Christophe Kourotchkine, Karim Barras, Bruno Paviot, Jean-Édouard Bodziak, Mathilde Warnier, Joséphine de La Baume, Marie-Julie Baup, Antoine Gouy, Julie Farenc",France,"July 30, 2018",2018,2,"At the height of the Cold War in 1960, André Merlaux joins the French Secret Service and contends with enemies both foreign and bureaucratic.",International TV
256,s257,TV Show,A Year In Space,,Scott Kelly,United States,"November 1, 2019",2015,1,Two astronauts attempt to brave a life in Earth's orbit on a record-setting mission to see if humans have the endurance to survive a flight to Mars.,Docuseries
258,s259,TV Show,A Young Doctor's Notebook and Other Stories,,"Daniel Radcliffe, Jon Hamm, Adam Godley, Christopher Godwin, Rosie Cavaliero, Vicki Pepperdine, Margaret Clunie, Tim Steed, Shaun Pye",United Kingdom,,2013,2,"Set during the Russian Revolution, this comic miniseries is based on a doctor's memories of his early career working in an out-of-the-way village.",British TV
259,s260,TV Show,A.D. Kingdom and Empire,,"Juan Pablo Di Pace, Adam Levy, Chipo Chung, Babou Ceesay, Emmett Scanlan, Will Thorp, Richard Coyle, Vincent Regan, Greta Scacchi, James Callis, Joanne Whalley, Jodhi May, Chris Brazier, Fraser Ayres, Jóhannes Haukur Jóhannesson, Ken Bones, Kenneth Collard",United States,"December 15, 2017",2015,1,"In the wake of Jesus Christ's crucifixion, his apostles dedicate themselves to spreading his message, risking their freedom and their lives.",TV Dramas
260,s261,TV Show,A.I.C.O.,Kazuya Murata,"Haruka Shiraishi, Yusuke Kobayashi, Makoto Furukawa, Taishi Murata, Kaori Nazuka, M・A・O, Ryota Takeuchi, Ai Kayano, Toru Okawa, Takehito Koyasu, Atsuko Tanaka",Japan,"March 9, 2018",2018,1,Everything Aiko knew was a lie. Now she's joining a team of Divers to reach the place where the Burst began to stop it for good and save her family.,Anime Series
276,s277,TV Show,Abby Hatcher,Kyran Kelly,"Macy Drouin, Wyatt White, Paul Sun-Hyung Lee, Michela Luci, Christian Dal Dosso, Laaibah Alvi, Leo Orgil",United States,"July 1, 2020",2019,1,"A big-hearted girl helps her Fuzzly friends who live in her family's hotel with exploring feelings, fixing mishaps and embracing their special quirks.",Kids
284,s285,TV Show,Abnormal Summit,"Jung-ah Im, Seung-uk Jo","Hyun-moo Jun, Si-kyung Sung, Se-yoon Yoo",South Korea," August 4, 2017",2017,2,"Led by a trio of Korean celebs, a multinational panel of men engage in – usually – lighthearted debates on issues that surround Korea and beyond.",International TV
288,s289,TV Show,Abstract: The Art of Design,,"Christoph Niemann, Tinker Hatfield, Es Devlin, Bjarke Ingels, Paula Scher, Platon, Ilse Crawford, Ralph Gilles",United States,"September 25, 2019",2019,2,Step inside the minds of the most innovative designers in a variety of disciplines and learn how design impacts every aspect of life.,Docuseries
289,s290,TV Show,Absurd Planet,,Afi Ekulona,United States,"April 22, 2020",2020,1,"A cast of quirky critters and Mother Nature herself narrate this funny science series, which peeks into the lives of Earth’s most incredible animals.",Docuseries
290,s291,TV Show,Abyss,,"Park Bo-young, Ahn Hyo-seop, Lee Sung-jae, Lee Si-eon, Han So-hee, Kwon Soo-hyun, Kim Sa-rang, Ahn Se-ha, Yun Yoo-sun",South Korea,"May 7, 2019",2019,1,"After meeting an untimely demise in separate incidents, Cha Min and Go Se-yeon discover they’ve come back to life in new bodies they don’t recognize.",Crime TV
294,s295,TV Show,Accidentally in Love,,"Junchen Guo, Yi Ning Sun, Yi Qin Zhao, Mu Xuan Cheng, Li Ma, Mo Zhou",China,"October 19, 2018",2018,1,"Rejecting the demands of her wealthy family, a young woman poses as an ordinary college student and crosses paths with a stoic pop star at school.",International TV
303,s304,TV Show,Ad Vitam,,"Yvan Attal, Garance Marillier, Niels Schneider, Victor Assié, Rod Paradot, Anne Azoulay, Adel Bencherif",France,"November 1, 2019",2018,1,"In a future where regeneration technology lets humans live indefinitely, a cop and a troubled young woman investigate a strange wave of youth suicides.",Crime TV
306,s307,TV Show,Adam Ruins Everything,,"Adam Conover, Adam Lustick, Emily Axford",United States,"September 30, 2018",2018,1,"Education can be fun – and funny. Comedian Adam Conover bursts misconceptions, deconstructs topics and leaves with positive takeaways.",TV Comedies
319,s320,TV Show,Afflicted,,,United States,"August 10, 2018",2018,1,Baffling symptoms. Controversial diagnoses. Costly treatments. Seven people with chronic illnesses search for answers – and relief.,Docuseries
321,s322,TV Show,Africa,,David Attenborough,United Kingdom,"April 28, 2016",2013,1,"This five-part nature series chronicles fascinating stories of survival on the African continent, home to the most diverse animal life on the planet.",British TV
322,s323,TV Show,Afronta! Facing It!,Juliana Vicente,"Loo Nascimento, Ingrid Silva, Rincon Sapiência, Batekoo, Gabriel Martins, Benjamin Abras, Daniele DaMata, Tasha & Tracie Okereke, Mariana de Matos, André Novais, Mahal Pita, Grace Passô, Thamyra Thâmara, Xenia França, Criola, Dani Ornellas, Anelis Assumpção, Magá Moura, Tássia Reis, Liniker, Yasmin Thayná, Raquel Virgínia, Juliana Luna, Erica Malunguinho, Diane Lima, Karol Conká",Brazil,"October 31, 2020",2017,1,"This docuseries spotlights Afro-Brazilian thinkers sharing their individual journeys and discussing representation, entrepreneurship and community.",Docuseries
324,s325,TV Show,After Life,,"Ricky Gervais, Tom Basden, Tony Way, Diane Morgan, Mandeep Dhillon, David Bradley, Ashley Jensen, Kerry Godliman",United Kingdom,"April 24, 2020",2020,2,"Struggling to come to terms with his wife's death, a writer for a newspaper adopts a gruff new persona in an effort to push away those trying to help.",British TV
333,s334,TV Show,Against the Tide,,"Christopher Lee, Rui En, Desmond Tan, Zheng Geping, Zhang Zhenhuan, Paige Chua, Xu Bin, Carrie Wong",Singapore,"July 1, 2017",2014,1,A detective and a psychologist investigating a string of murders form a crime-solving team with the novelist whose work inspired the killings.,Crime TV
335,s336,TV Show,Age Gap Love,,Fay Ripley,United Kingdom,"July 12, 2019",2017,1,"Despite the social backlash and challenges that come with intergenerational romance, these couples choose to stick together through thick and thin.",British TV
336,s337,TV Show,Age of Glory,,"Debbie Goh, Aenie Wong, Frederick Lee, Leslie Chai",,"August 14, 2017",2010,2,"Amid the thriving nightlife of 1960s Kuala Lumpur, three Chinese friends – a showgirl, her housekeeper and a chanteuse – find love and heartbreak.",International TV
337,s338,TV Show,Age of Rebellion,Peter Ho,"Peter Ho, Jeanine Yang, Tammy Chen, Jason Tsou, Chang Ting-hu, Nana Lee, Nien Hsuan Wu",Taiwan,"September 1, 2018",2018,1,"At their high school, a group of unruly teens wreak havoc, face bullies and navigate turbulent lives beyond school grounds.",Crime TV
338,s339,TV Show,Age of Tanks,,,Germany,"November 10, 2018",2017,1,The history of military tanks unfolds in a documentary series that traces their role in history and geopolitics from World War I to the 21st century.,Docuseries
339,s340,TV Show,Agent,,"Khumbulani Kay Sibiya, Sisanda Henna, Tarynn Wyngaard, Anthony Oseyemi, Virgile Bramly, Manie Malone, Yannick Konnan, Vinaya Sungkur, Michaella Russell, Thabo Malema",Mauritius,"December 20, 2019",2019,1,"A former footballer tries to make it as a player agent in the world of African soccer, but a secret from his past threatens to destroy everything.",International TV
340,s341,TV Show,Agent Raghav,,"Sharad Kelkar, Aahana Kumra, Mahesh Manjrekar, Deepali Pansare, Danish Pandor, Jason Tham, Reena Aggarwal, Swati Rajput",India,"April 15, 2017",2015,1,"A mix of brilliance, erudition and skill enables a modern Sherlock Holmes to solve impossible cases, all while he tries to heal personal wounds.",Crime TV
341,s342,TV Show,Aggretsuko,,"Kaolip, Komegumi Koiwasaki, Maki Tsuruta, Sohta Arai, Rina Inoue, Shingo Kato, Yuki Takahashi",Japan,"August 27, 2020",2020,3,"Frustrated with her thankless office job, Retsuko the Red Panda copes with her daily struggles by belting out death metal karaoke after work.",Anime Series
348,s349,TV Show,Ainori Love Wagon: African Journey,,"Becky, Ryo Kato, Karina Maruyama, Kohei Takeda",Japan,"January 30, 2020",2019,1,"To find love, seven strangers leave Japan and embark on a journey through the continent of Africa together. Challenges, adventure and romance await!",International TV
349,s350,TV Show,Ainori Love Wagon: Asian Journey,,"Becky, Audrey, Mayuko Kawakita, Shimon Okura",Japan,"March 28, 2019",2018,2,"Seven men and women board a pink bus in search of true love. On a journey through Asia with strangers, their goal is to return to Japan as a couple.",International TV
350,s351,TV Show,Ainsley Eats the Streets,,Ainsley Harriott,United Kingdom,"July 12, 2019",2014,1,Celebrity chef Ainsley Harriott embarks on a journey around the world to explore the relationship between local street foods and cultural identity.,British TV
357,s358,TV Show,AJ and the Queen,,"RuPaul Charles, Izzy G., Michael-Leon Wooley, Josh Segarra, Katerina Tannenbaum, Tia Carrere",United States,"January 10, 2020",2020,1,"While traveling across the country in a run-down RV, drag queen Ruby Red discovers an unlikely sidekick in AJ: a tough-talking 10-year-old stowaway.",TV Comedies
359,s360,TV Show,Ajaibnya Cinta,,,,"October 13, 2017",2015,1,"Upon returning home from his studies abroad, young grad Akif finds himself involved with four women in this continuation of the series ""Spain Uoolss.""",International TV
