,show_id,type,title,director,cast,country,date_added,release_year,duration,description,genre
5905,s5906,TV Show,Super Wings,,"Luca Padovan, Evan Smolin, Junah Jang, Colin Critchley",United States,"December 1, 2020",2020,3,A cheerful jet and his transforming pals strive to find peaceful solutions to their problems while delivering packages to children around the globe.,Kids
5908,s5909,TV Show,Supergirl,Jesse Warn,"Melissa Benoist, Mehcad Brooks, Chyler Leigh, Jeremy Jordan, David Harewood, Calista Flockhart, Emma Tremblay, Adrian Pasdar, Katie McGrath, David St. Louis, Odette Annable, Floriana Lima, Erica Durance",United States,"May 25, 2020",2019,5,"To avert a disaster, Kara Danvers reveals her powers and true identity: She is Superman's cousin, now known as Supergirl, protector of National City.",TV Action
5911,s5912,TV Show,Supermarket Sweep,,,United States,"July 2, 2020",1993,1,"In this iconic game show, contestants answer food trivia questions then race against the clock while stuffing their carts for massive grocery gains.",Reality TV
5912,s5913,TV Show,Supernatural,Phil Sgriccia,"Jared Padalecki, Jensen Ackles, Mark Sheppard, Misha Collins, Jim Beaver, Andrea Menard, Samantha Smith, Mark Pellegrino, Alexander Calvert",United States,"June 5, 2020",2019,15,"Siblings Dean and Sam crisscross the country, investigating paranormal activity and picking fights with demons, ghosts and monsters.",Classic
5913,s5914,TV Show,SuperNature: Wild Flyers,,,United Kingdom,"March 1, 2017",2016,1,This series examines the aerodynamics of flight and the evolutionary processes that have enabled certain species to survive by taking to the skies.,British TV
5921,s5922,TV Show,Surviving Death,,,United States,"January 6, 2021",2021,1,"What happens after we die? This docuseries explores personal stories and research on near-death experiences, reincarnation and paranormal phenomena.",Docuseries
5922,s5923,TV Show,Surviving Escobar - Alias JJ,,"Juan Pablo Urrego, Amparo Grisales, Nicole Santamaría, Elkin Díaz, Francisco Javier Rueda, Ramsés Ramos, Lina Marcela Castrillón, Toto Vega, Camilo Sáenz, Mijail Mulkay, Natasha Klauss, Nelson Camayo",,"August 1, 2017",2017,1,"As the Medellín Cartel crumbles, Pablo Escobar's No. 1 hit man struggles to stay alive and gain respect in the prison hierarchy.",Crime TV
5923,s5924,TV Show,Surviving R. Kelly,,R. Kelly,United States,"September 15, 2019",2019,1,"In this documentary series on the tangled history of allegations against musician R. Kelly, women give detailed accounts of sexual and mental abuse.",Crime TV
5924,s5925,TV Show,Surviving R. Kelly Part II: The Reckoning,,R. Kelly,United States,"April 13, 2020",2020,1,"As more women come forward with harrowing accusations against R. Kelly, his criminal case gains momentum in this follow-up to the powerful docuseries.",Crime TV
5926,s5927,TV Show,Survivor,,"Jeff Probst, Jerri Manthey, Colby Donaldson, Rupert Boneham, Parvati Shallow, Rob Mariano, Amanda Kimmel, James Clement, Amber Brkich, Alicia Calaway, Ethan Zohn, Tina Wesson",United States,"November 15, 2020",2014,2,"In this long-running reality competition series, players battle the elements and each other as they vie for $1 million and the title of Sole Survivor.",Reality TV
5934,s5935,TV Show,Swami Baba Ramdev: The Untold Story,,"Naman Jain, Kranti Prakash Jha, Tej Sapru, Chetan Pandit, Hitesh Bhardwaj, Sadhil Kapoor",,"May 1, 2018",2018,1,"Born into poverty and denied an education, a village boy overcomes society’s obstacles to become India’s foremost spiritual guru, revered by millions.",International TV
5938,s5939,TV Show,Sweet Magnolias,,"JoAnna Garcia Swisher, Brooke Elliott, Heather Headley, Chris Klein, Justin Bruening, Logan Allen, Anneliese Judge, Carson Rowland, Jamie Lynn Spears, Dion Johnstone",United States,"May 19, 2020",2020,1,"Lifelong friends Maddie, Helen and Dana Sue lift each other up as they juggle relationships, family and careers in the small, Southern town of Serenity.",Romantic TV
5943,s5944,TV Show,Switched,,"Daiki Shigeoka, Tomohiro Kamiyama, Kaya Kiyohara, Miu Tomita, Reika Kirishima, Shinji Rokkaku, Miu Suzuki, Riko Hisada, Megumi Seki, Shoko Nakajima",Japan,"August 1, 2018",2018,1,"High schooler Ayumi's perfect world evaporates when her envious classmate Zenko somehow steals her body, her boyfriend and her life.",International TV
5944,s5945,TV Show,Sword Art Online,,"Yoshitsugu Matsuoka, Haruka Tomatsu, Ayana Taketatsu, Kanae Ito, Rina Hidaka, Ayahi Takagaki, Hiroaki Hirata, Hiroki Yasumoto, Saori Hayami, Koichi Yamadera",Japan,"October 1, 2020",2018,3,A video game whiz helps create a new technology that enables players to guide their online avatars with their own bodies – but a dark twist emerges.,Anime Series
5945,s5946,TV Show,Sword Art Online Alternative: Gun Gale Online,,"Tomori Kusunoki, Yoko Hikasa, Kazuyuki Okitsu, Chinatsu Akasaki",Japan,"February 1, 2019",2018,1,College student Karen takes up Gun Gale Online and gets a reputation as the Pink Demon. Then her gaming buddy Pitohui asks her to join the Squad Jam.,Anime Series
5949,s5950,TV Show,SWORDGAI The Animation,,"Yuto Uemura, Yuuka Aisaka, Nobunaga Shimazaki, Yuuichirou Umehara, Toshihiko Seki, Jouji Nakata, Rina Satou, Tomokazu Sugita, Hiro Shimono, Ayane Sakura, Urara Takano, Kohei Murakami, Maaya Uchida, Takaya Kuroda, Michiko Neya, Takaya Hashi",Japan,"July 30, 2018",2018,2,"A young man becomes host to a legendary infernal sword and, with the fate of humanity now in his arm, wields its demonic power against his enemies.",Anime Series
5951,s5952,TV Show,Sym-Bionic Titan,,"Tara Strong, Kevin Thoms, Brian Posehn, John DiMaggio, Tim Russ, Don Leslie, Kari Wahlgren",United States,"December 15, 2019",2010,1,"Aliens fleeing their planet land on Earth, pose as teenagers and fight off mutant space monsters by joining forces to become a powerful giant robot.",Kids
5955,s5956,TV Show,Tabula Rasa,,"Veerle Baetens, Stijn Van Opstal, Jeroen Perceval, Hilde Van Mieghem, Gene Bervoets, Peter Van den Begin, Natali Broods",Belgium,"March 15, 2018",2017,1,"When a young woman with amnesia becomes a key figure in a missing persons case, she must reconstruct her memories to clear her name.",International TV
5956,s5957,TV Show,Taco Chronicles,,,United States,"September 15, 2020",2020,2,"Many of the most popular taco styles have long, rich, little-known histories. Explore some of them in this eye-opening, mouth-watering food adventure.",Docuseries
5958,s5959,TV Show,Taj Mahal 1989,,"Neeraj Kabi, Geetanjali Kulkarni, Danish Husain, Sheeba Chaddha, Paras Priyadarshan, Anshul Chauhan, Anud Singh Dhaka, Shirin Sewani, Mihir Ahuja, Vasundhara Rajput",India,"February 14, 2020",2020,1,"In and around Lucknow University in 1989, couples of varying ages explore the politics of love through marriage, budding romances and friendships.",International TV
5961,s5962,TV Show,Take My Brother Away,Han Qing,"Sun Qian, Joseph Zeng, Lv Xiao Yu, Hu Yong Tao, Wang Xu Dong, Ma Bai Quan",China,"August 24, 2018",2018,1,"Bickering siblings Shi Miao and Shi Fen tackle friendship matters, school drama and the pitfalls of growing up with little parental supervision.",International TV
5965,s5966,TV Show,Taken,,"Clive Standen, Jennifer Beals, Gaius Charles, Brooklyn Sudano, Monique Gabriela Curnen, Michael Irby, James Landry Hébert, Jose Pablo Cantillo, James Landry Hebert",France," January 12, 2019",2018,2,"After a personal tragedy upends his life, a highly skilled former Green Beret is drawn into a career as a secret government operative.",Crime TV
5967,s5968,TV Show,Takki,,"Moayed Althagafi, Khairiah Abulaban, Ali Alsharif, Adel Redwan, Redwan Alremey, Hind Alsaigh, Reem Alhabib, Khaled Bamashmoos, Fahad Ghazoli, Dareen Albayedh, Naif Althufairi, Mohammad Balkhi",Saudi Arabia,"August 15, 2020",2014,2,"In Jeddah, Saudi Arabia, a young aspiring filmmaker and his circle of friends grapple with family expectations, gender roles, romance and rivalry.",International TV
5970,s5971,TV Show,Tales by Light,,"Darren Jew, Art Wolfe, Krystle Wright, Peter Eastway, Richard l’Anson, Jack Thompson, Jonathan Scott, Angela Scott, Eric Cheng, Stephen Dupont",Australia,"January 5, 2019",2018,3,"Follow renowned photographers as they explore far-flung locales, capturing extraordinary images that present nature and culture in a new light.",Docuseries
5972,s5973,TV Show,Tales of the City,,"Laura Linney, Ellen Page, Olympia Dukakis, Paul Gross, Murray Bartlett, Barbara Garrick, Charlie Barnett, Garcia, May Hong, Jen Richards, Victor Garber, Ashley Park, Christopher Larkin, Zosia Mamet, Molly Ringwald, Daniela Vega",United States,"June 7, 2019",2019,1,"Returning to San Francisco after a long absence, Mary Ann Singleton reunites with the community of characters at 28 Barbary Lane.",TV Dramas
5973,s5974,TV Show,Tales of the City (1993),,"Olympia Dukakis, Donald Moffat, Laura Linney, Marcus D'Amico, Billy Campbell, Thomas Gibson, Paul Gross, Barbara Garrick, Chloe Webb, Nina Foch, Parker Posey, Stanley DeSantis",United Kingdom,"June 28, 2019",1993,1,"In 1976, naive Mary Ann Singleton moves to San Francisco and finds a new family in her bohemian landlady and the eclectic residents at 28 Barbary Lane.",TV Dramas
5974,s5975,TV Show,Talking Tom and Friends,,"Colin Hanks, Tom Kenny, James Adomian, Lisa Schwartz, Maria Bamford",Cyprus,"February 15, 2020",2017,1,"Full of funny one-liners and always ready for an adventure, a talking cat and his equally chatty animal cohorts set out to become famous.",Kids
5980,s5981,TV Show,Tango,,"Bassel Khayyat, Daniella Rahme, Bassam Moughneih, Dana Mardini, Youssef Haddad, Talal Jarday, Sameera Barody",Lebanon,"April 3, 2019",2018,1,Shocking secrets begin to unravel when the aftermath of a car crash leaves four best friends questioning the truth of their relationships.,International TV
5995,s5996,TV Show,Tayee,,"Amr Youssef, Amr Abdel Guelil, Saba Mubarak",Egypt,"February 5, 2019",2018,1,An Egyptian doctor becomes a police informant and uses his rare gift of tracking ancient artifacts in the smuggling business.,International TV
5998,s5999,TV Show,Tayo the Little Bus,,"Robyn Slade, Kami Desilets",South Korea,"July 1, 2019",2014,2,"As they learn their routes around the busy city, Tayo and his little bus friends discover new sights and go on exciting adventures every day.",Kids
6003,s6004,TV Show,Team Kaylie,,"Bryana Salaz, Alison Fernandez, Symera Jackson, Elie Samouhi, Kai Calhoun, Eliza Pryor, Rosa Blasi, Nicole Sullivan, David Gridley",United States,"February 3, 2020",2020,3,"After a brush with the law, teen celebrity Kaylie Konrad swaps social stardom for court-ordered chaos as a middle school wilderness club leader.",Kids
6005,s6006,TV Show,Teasing Master Takagi-san,,"Rie Takahashi, Yuki Kaji, Konomi Kohara, M・A・O, Yui Ogura, Yuma Uchida, Kotori Koiwai, Nobuhiko Okamoto, Fukushi Ochiai",Japan,"December 6, 2019",2019,1,"Teased constantly by classmate Takagi-san, middle-schooler Nishikata swears payback by trying (and failing) to give her a dose of her own medicine.",Anime Series
6009,s6010,TV Show,Teen Mom 2,,"Jenelle Evans, Chelsea Houska, Kailyn Lowry, Leah Messer",United States,"December 15, 2020",2011,2,"The highs and lows of new parenting and adulting create drama and heartbreak as life moves on for the cast of ""16 and Pregnant"" Season 2.",Reality TV
6011,s6012,TV Show,Teenage Bounty Hunters,,"Anjelica Bette Fellini, Maddie Phillips, Kadeem Hardison, Virginia Williams, Mackenzie Astin, Shirley Rumierk, Myles Evans, Devon Hales, Spencer House, Eric Graise, Charity Cervantes, Wynn Everett, Method Man",United States,"August 14, 2020",2020,1,Twin sisters Sterling and Blair balance teen life at an elite Southern high school with an unlikely new career as butt-kicking bounty hunters.,Crime TV
6023,s6024,TV Show,Teresa,,"Angelique Boyer, Sebastián Rulli, Aarón Díaz, Cynthia Klitbo, Ana Brenda Contreras, Daniel Arenas, Margarita Magaña, Manuel Landeta, Felicia Mercado, Silvia Mariscal",Mexico,"December 31, 2017",2010,1,"We all want so much more than we have, but how far are we willing to go to get it?",International TV
6028,s6029,TV Show,Terrace House: Aloha State,,"You, Reina Triendl, Ryota Yamasato, Yoshimi Tokui, Azusa Babazono, Kentaro",United States,"September 26, 2017",2017,4,"The beautiful island of Oahu is host to a new batch of six strangers who share a single roof, multiple conflicts and no script in this reality series.",International TV
6029,s6030,TV Show,Terrace House: Boys & Girls in the City,,"You, Reina Triendl, Ryota Yamasato, Yoshimi Tokui, Azusa Babazono, Ayumu Mochizuki, Kentaro",Japan,"April 1, 2016",2016,2,"A new set of six men and women start their lives together under one roof. All they get is a fabulous home and a car. As always, there is no script.",International TV
6030,s6031,TV Show,Terrace House: Opening New Doors,,"You, Reina Triendl, Yoshimi Tokui, Azusa Babazono, Ryota Yamasato, Shono Hayama",Japan,"March 12, 2019",2018,6,"A group of young people – including a chef, a snowboarder and an ice hockey player – gather in the Karuizawa woods while pursuing their dreams.",International TV
6031,s6032,TV Show,Terrace House: Tokyo 2019-2020,,"You, Reina Triendl, Yoshimi Tokui, Azusa Babazono, Ryota Yamasato, Shono Hayama",Japan,"August 10, 2020",2019,2,"Six strangers share a fabulous house in Tokyo, looking for love while living under the same roof. With no script, what happens next is all up to them.",International TV
6033,s6034,TV Show,Terrorism Close Calls,,,United States,"October 26, 2018",2018,1,Law enforcement officials look back on attempted terrorist attacks that were thwarted in the nick of time.,Crime TV
6036,s6037,TV Show,Th Eena Meena Deeka Chase Comedy Show,Dheeraj Berry,"Sanjay Keni, Priya Raina",India,"March 31, 2018",2015,1,"A hungry fox and three resourceful, surprisingly formidable birds turn the animal kingdom on its head in this lively animated series.",Kids
6038,s6039,TV Show,Thackeray,,,India,"May 25, 2019",2019,1,"From controversial cartoonist to powerful Mumbai politician, this biopic maps the meteoric rise of far-right Shiv Sena party founder, Bal Thackeray.",TV Shows
6043,s6044,TV Show,That '70s Show,,"Topher Grace, Mila Kunis, Ashton Kutcher, Danny Masterson, Laura Prepon, Wilmer Valderrama, Debra Jo Rupp, Kurtwood Smith, Don Stark, Tanya Roberts, Tommy Chong, Lisa Robin Kelly",United States," November 1, 2017",2005,8,"Feel groovy in 1970s suburbia, where a teen and his pals hang in the basement, listening to rock and indulging other hazy benefits of '70s culture.",TV Comedies
6045,s6046,TV Show,"That Winter, the Wind Blows",,"Zo In-sung, Song Hye-kyo, Kim Bum, Jung Eun-ji, Bae Jong-ok, Young-hoon Kim",South Korea,"April 1, 2019",2013,1,"Seeing the chance to enrich himself by deceiving a blind heiress, clever con man Oh Soo just does what comes naturally – but his plans soon change.",International TV
6046,s6047,TV Show,The 10 Sins,,"Abdul Mohsen Alnimer, Haifa Hussien, Qahtan Alqahtani, Mohammed Sefer, Abdulla Bu Shehri",,"March 22, 2019",2018,1,"In this social drama of sin and remorse, a man reels at the discovery that his wife has been unfaithful, and gives her an ultimatum.",International TV
6047,s6048,TV Show,The 100,,"Eliza Taylor, Paige Turco, Bob Morley, Marie Avgeropoulos, Christopher Larkin, Henry Ian Cusick, Isaiah Washington, Lindsey Morgan, Devon Bostick, Richard Harmon, Ricky Whittle, Jarod Joseph, Chelsey Reist, Sachin Sahel, Adina Porter",United States,"October 8, 2020",2020,7,"A century after Earth was devastated by a nuclear apocalypse, 100 space station residents are sent to the planet to determine whether it's habitable.",TV Action
6050,s6051,TV Show,The 2000s,,,United States,"February 19, 2019",2018,1,"Examine the triumphs, tragedies, cultural shifts and technological leaps that occurred during the millennium's first decade.",Docuseries
6055,s6056,TV Show,The 43,,Paco Ignacio Taibo II,,"February 15, 2019",2019,1,This docuseries disputes the Mexican government's account of how and why 43 students from Ayotzinapa Rural Teachers' College vanished in Iguala in 2014.,Crime TV
6056,s6057,TV Show,The 4400,,"Joel Gretsch, Jacqueline McKenzie, Patrick John Flueger, Conchita Campbell, Chad Faust, Richard Kahan, Mahershala Ali, Billy Campbell",United States,"September 1, 2013",2007,4,"4400 people who vanished over the course of five decades suddenly reappear. None have aged, and slowly it's revealed that they have mysterious powers.",TV Dramas
6059,s6060,TV Show,The A List,,"Lisa Ambalavanar, Ellie Duckles, Savannah Baker, Cian Barry, Eleanor Bennett, Jacob Dudman, Rosie Dwyer, Jack Kane, Max Lohan, Nneka Okoye, Micheal Ward, Georgina Sadler, Indianna Ryan",United Kingdom,"August 30, 2019",2018,1,"Romance, rivalry and radical mystery collide as a group of teens attend a remote island sleepaway camp in this suspenseful, supernatural drama.",British TV
6063,s6064,TV Show,The Adjusters,,"Rynn Lim, Chris Tong, Aric Ho, Chan Fong",,"September 18, 2017",2010,2,"An insurance adjuster investigates cases of possible fraud while hiding a romance with a colleague, unaware that someone he trusts is toying with him.",International TV
6065,s6066,TV Show,The Adventures of Figaro Pho,,"Luke Jurevicius, Craig Behenna, Charlotte Hamlyn, Stavroula Mountzouris, Aletheia Burney",Australia,,2015,2,"Imagine your worst fears, then multiply them: Figaro is a boy with any number of phobias and a highly quirky and imaginative way of dealing with them.",Kids
6066,s6067,TV Show,The Adventures of Puss in Boots,,"Eric Bauza, Jayma Mays, Grey DeLisle, Paul Rugg, Joshua Rush, Candi Milo, Laraine Newman",United States,"January 26, 2018",2018,6,"The world's greatest feline fighter, lover and milk connoisseur takes on daring adventures in exotic locations in this family-friendly comedy series.",Kids
6068,s6069,TV Show,The Adventures of Sonic the Hedgehog,,"Jaleel White, Long John Baldry, Garry Chalk",United States,"April 18, 2018",1993,1,"Hyper hedgehog Sonic and his cohort Miles ""Tails"" Prower defend the planet Mobius against Dr. Robotnik and his evil schemes in this animated series.",Kids
6074,s6075,TV Show,The Alcàsser Murders,Elías León,,Spain,"June 15, 2019",2019,1,New interviews and an up-to-date analysis of evidence shed light on the 1992 murders of three girls in Spain and their profound impact on the nation.,Crime TV
6076,s6077,TV Show,The American Barbecue Showdown,,"Lyric Lewis, Rutledge Wood",United States,"September 18, 2020",2020,1,Eight of the country's best backyard smokers and pitmasters vie for the title of American Barbecue Champion in a fierce but friendly faceoff.,Reality TV
6077,s6078,TV Show,The American Bible Challenge,Michael Simon,Jeff Foxworthy,United States,"June 15, 2020",2013,2,"Join host Jeff Foxworthy as contestants test their knowledge of all things biblical, competing to win money for the charities of their choice.",Reality TV
6082,s6083,TV Show,The Andy Griffith Show,,"Andy Griffith, Ron Howard, Don Knotts, Frances Bavier, Howard McNear, Hope Summers",United States," July 1, 2017",1967,8,"Homespun humor and easygoing Sheriff Andy Taylor are at the center of this nostalgic look at Mayberry, a small town filled with lovable characters.",Classic
6087,s6088,TV Show,The Apartment,,"Jamie Durie, Laurence Llewelyn-Bowen",Singapore," December 14, 2018",2014,2,"With their eyes on the grand prize, amateur designers push their creative limits in this reality competition show hosted by design icon Jamie Durie.",International TV
6096,s6097,TV Show,The Assassination of Gianni Versace,,"Edgar Ramírez, Darren Criss, Ricky Martin, Penélope Cruz",United States,"March 6, 2019",2018,1,"Defining moments in Andrew Cunanan's life, starting in childhood, lead up to a 1997 murder spree that kills five, including fashion icon Gianni Versace.",Crime TV
6101,s6102,TV Show,The Baby-Sitters Club,,"Sophie Grace, Momona Tamada, Shay Rudolph, Malia Baker, Xochitl Gomez, Alicia Silverstone, Mark Feuerstein, Marc Evan Jackson, Aya Furukawa, Jessica Elaina Eason",United States,"July 3, 2020",2020,1,Ann M. Martin's beloved books get a modern update in this series that follows a group of girlfriends and their homegrown babysitting business.,Kids
6104,s6105,TV Show,The Bachelor,,,,"December 1, 2019",2009,1,A single man searches for his soulmate through a series of dates with 25 contestants ready to romance him for a chance at love.,Reality TV
6105,s6106,TV Show,The Bachelorette,,,United States,"December 1, 2020",2010,1,Beloved “Bachelor” contestant Ali Fedotowsky embarks on her own search for happily ever after and navigates the thrills and spills of reality TV romance.,Reality TV
6114,s6115,TV Show,The Barrier,,"Unax Ugalde, Olivia Molina, Eleonora Wexler, Abel Folk, Ángela Molina, Manu Fullola, Daniel Ibáñez, Laura Quirós, Nicolás Illoro, Belén Écija, Juan Blanco, Yaima Ramos",Spain,"September 11, 2020",2020,1,One family’s fight for survival in a future dystopian Madrid illustrates the disparity between two worlds separated by a fence — and so much more.,International TV
6121,s6122,TV Show,The Beat,,"Henley Hii, Yise Loo, Aric Ho, Tiffany Leong, Issac Dang, Christy Yow",,"September 18, 2017",2012,1,"The artistic pursuits of two childhood friends, an aspiring singer and a talented dancer, lead them to four other 20-somethings in a drumming group.",International TV
6124,s6125,TV Show,The Beginning of Life: The Series,Estela Renner,,Brazil,"November 11, 2016",2016,1,"Using breakthroughs in technology and neuroscience, this series examines how environment affects infants – and how infants can affect our future.",Docuseries
6126,s6127,TV Show,The Bible's Buried Secrets,,Francesca Stavrakopoulou,United Kingdom,"February 1, 2019",2011,1,"Host Francesca Stavrakopoulou travels across the Middle East, offering extraordinary insights into the stories of the Old Testament.",British TV
6127,s6128,TV Show,The Big Catch,,Ben Fogle,United Kingdom,"February 1, 2019",2015,1,"In a global competition, eight fishing enthusiasts battle extreme conditions and dangerous waters to be crowned the ultimate angler.",British TV
6128,s6129,TV Show,The Big Family Cooking Showdown,,"Zoe Ball, Nadiya Hussain, Giorgio Locatelli, Rosemary Shrager",United Kingdom,"February 22, 2019",2018,2,"In this unscripted series, families passionate about food serve up their most delicious dishes for the chance to be crowned Britain's best home cooks.",British TV
6129,s6130,TV Show,The Big Flower Fight,,"Natasia Demetriou, Vic Reeves, Kristen Griffith-Vanderyacht",United Kingdom,"May 18, 2020",2020,1,"Ten pairs of florists, sculptors and garden designers face off in a friendly floral fight to see who can build the biggest, boldest garden sculptures.",British TV
6130,s6131,TV Show,The Big Show Show,,"Paul Wight, Allison Munn, Reylynn Caster, Lily Brooks O'Briant, Juliet Donenfeld",United States,"December 9, 2020",2020,2,Former WWE wrestler the Big Show is out of the ring and ready for an even tougher challenge: raising three daughters with his wife in Florida.,Kids
6140,s6141,TV Show,The Blacklist,,"James Spader, Megan Boone, Diego Klattenhoff, Ryan Eggold, Harry Lennix, Amir Arison, Hisham Tawfiq, Mozhan Marnò",United States,"September 18, 2020",2019,7,"After turning himself in, a brilliant fugitive offers to help the FBI bag other baddies, but only if rookie profiler Elizabeth Keen is his partner.",Crime TV
6148,s6149,TV Show,The Blue Planet: A Natural History of the Oceans,Alastair Fothergill,David Attenborough,United Kingdom,"October 10, 2015",2001,1,"David Attenborough narrates this definitive exploration of the marine world, from the familiar to the unknown, revealing the sea and its communities.",British TV
6153,s6154,TV Show,The Bomb Squad,,Christopher Eccleston,United Kingdom,"February 1, 2019",2011,1,This documentary follows British bomb disposal teams in Afghanistan and the dangers they face in their methodical lives on the front lines of war.,British TV
6154,s6155,TV Show,The Bonfire of Destiny,,"Audrey Fleurot, Julie de Bona, Camille Lou, Gilbert Melki, Josiane Balasko, Antoine Duléry, Florence Pernel, Théo Fernandez, Victor Meutelet, François-David Cardonnel, Stéphane Guillon, Aurélien Wiik, Gilles Cohen",France,"December 26, 2019",2019,1,"After a devastating fire in 1897 Paris, three women find their lives upended by betrayals, deceptions and romantic turmoil. Inspired by real events.",International TV
6157,s6158,TV Show,The Borgias,,"Jeremy Irons, François Arnaud, Holliday Grainger, Peter Sullivan, Sean Harris, Joanne Whalley, Lotte Verbeek, Colm Feore, Vernon Dobtcheff, David Oakes",United States,"February 1, 2014",2013,3,"Follow the lives of the notorious Borgia family, a clan headed by plotting patriarch Rodrigo and his beautiful but treacherous daughter, Lucrezia.",TV Dramas
6158,s6159,TV Show,The Boss Baby: Back in Business,,"JP Karliak, Pierce Gagnon, Kevin Michael Richardson, Alex Cazares, Flula Borg, Jake Green, Eric Bell Jr., David Lodge, Hope Levy, David Collins, Tony Hale, Nicole Sullivan",United States,"November 17, 2020",2020,4,The Boss Baby brings his big brother Tim to the office to teach him the art of business in this animated series sprung from the hit film.,Kids
6161,s6162,TV Show,The Boulet Brothers Dragula,,Boulet Brothers,United States,"November 1, 2019",2019,2,"Ten queens must slay the competition and put their fiercest, filthiest faces forward for the chance to be crowned the world's next drag supermonster.",Reality TV
6174,s6175,TV Show,The Break,,"Yoann Blanc, Guillaume Kerbush, Anne Coesens, Jasmina Douieb, Tom Audenaert, Sam Louwyck, Catherine Salée, Jean-Henri Compère",Belgium,"February 9, 2019",2018,2,"A police detective mourning a painful loss moves back to his peaceful hometown, only to be drawn into a murder case that dredges up dark secrets.",Crime TV
