,show_id,type,title,director,cast,country,date_added,release_year,duration,description,genre
1994,s1995,TV Show,Emogenius,,Hunter March,United States,"December 15, 2018",2017,1,"Two pairs of contestants go head-to-head for several rounds, deciphering puzzles and messages comprised of emojis for a chance at a $10,000 prize.",Reality TV
1995,s1996,TV Show,Empire Games,,Jim O'Brien,Czech Republic,"October 5, 2018",2018,1,Interviews with scholars and dramatic reenactments bring to life the origins and history-making achievements of the world's greatest ancient empires.,Docuseries
1998,s1999,TV Show,Encerrados,,"Luis Machín, Maria Merlino, Fabián Vena, Ana Chalentano, Nelly Prince, Victor Laplace, Silvia Pérez, Pilar Gamboa, Alberto Ajaka, Fabio Alberti, Martin Slipak, Martín Piroyansky, Paula Ransenberg",,"June 18, 2018",2018,1,"This fictional series tells the stories of what happens to people when they feel caged in, whether physically, psychologically or emotionally.",International TV
2000,s2001,TV Show,Encounters with Evil,,Richard Lintern,United Kingdom,"July 12, 2019",2016,1,"This documentary series tries to get at the root of some of the most heinous crimes ever committed by deranged, cold-blooded criminals.",British TV
2003,s2004,TV Show,Enemigo íntimo,,"Raúl Méndez, Fernanda Castillo, Matias Novoa, Guillermo Quintanilla, Leonardo Daniel, Otto Sirgo, Alejandro Speitzer, Armando Hernández, Valentina Acosta, Elvira Monsell",,"August 8, 2018",2018,1,"Siblings separated as children who no longer recognize each other are pitted against each other in a war involving drugs, crime and betrayal.",Crime TV
2005,s2006,TV Show,Engineering Girls,,"Barkha Singh, Kritika Avasthi, Sejal Kumar",India,"October 1, 2019",2018,1,"Three engineering students deal with dorm drama, date around, and do whatever it takes to make their dreams come true.",International TV
2010,s2011,TV Show,Entangled,,"Thomas Ong, Jack Tan, Margaret Wang, Kate Pang, Huang Qi Ming, Aileen Tan, Rayson Tan, Zhang Shui Fa",South Korea,"August 1, 2017",2014,1,"When the children of two families become friends, they begin to unravel a horrific crime in the past that already linked their fathers to each other.",International TV
2015,s2016,TV Show,Episodes,,"Matt LeBlanc, Tamsin Greig, Stephen Mangan, Kathleen Rose Perkins, John Pankow, Mircea Monroe",United Kingdom,"January 6, 2018",2017,5,"Hoping to create an American version of their hit British sitcom, two screenwriters run into cultural obstacles, starting with the lead character.",Classic
2017,s2018,TV Show,Equestria Girls: Tales of Canterlot High,,"Tara Strong, Ashleigh Ball, Andrea Libman, Tabitha St. Germain, Cathy Weseluck, Rebecca Shoichet, Andrew Toth, Ali Liebert",United States,"October 1, 2017",2017,1,"In an alternate universe Equestria, the ponies have become teenage girls who must learn what it means to be human while attending Canterlot High.",Kids
2019,s2020,TV Show,Equinox,,"Danica Curcic, Karoline Hamm, Viola Martinsen, Lars Brygmann, Hanne Hedelund, August Issac Carter, Fanny Leander Bornedal, Ask Mossberg Truelsen, Peder Holm Johansen, Alexandre Willaume, Susanne Storm, Andrea Engelsmann Persson, Thomas Chaanhing, Morten Hauch-Fausbøll, Eskil Tonnesen",Denmark,"December 30, 2020",2020,1,"Haunted by visions after her sister vanished with her classmates 21 years before, Astrid begins an investigation that uncovers the dark, eerie truth.",International TV
2020,s2021,TV Show,Erased,,"Tao Tsuchiya, Shinnosuke Mitsushima, Aoi Yuki, Chinatsu Akasaki, Yo Taichi, Akari Kito, Ayaka Nanase, Yukitoshi Kikuchi, Takahiro Mizushima, Minami Takayama, Mitsuru Miyamoto",Japan,"September 1, 2020",2016,1,"Satoru Fujinuma can travel back in time to save others' lives. When he wakes up 18 years in the past, he has a chance to save his murdered classmates.",Anime Series
2027,s2028,TV Show,Especial 20 años Fútbol de Primera,,,,"May 20, 2020",2020,1,"Revisit the emotional bouts and memorable highlights from the past two decades in this special celebrating esteemed TV show ""Fútbol de Primera.""",Docuseries
2030,s2031,TV Show,Eternal Love,,"Yang Mi, Mark Chao, Dilraba Dilmurat, Ken Chang, Vengo Gao, Huang Mengying",China,"November 17, 2018",2017,1,"After the deities Bai Qian and Ye Hua meet and fall in love, their romance stands the test of three lifetimes — each an epic in its own right.",International TV
2032,s2033,TV Show,Ethos,,"Öykü Karayel, Fatih Artman, Funda Eryiğit, Defne Kayalar, Settar Tanrıöğen, Tülin Özen, Alican Yücesoy, Bige Önal",Turkey,"November 12, 2020",2020,1,A group of individuals in Istanbul transcend sociocultural boundaries and find connection as their fears and wishes intertwine.,International TV
2033,s2034,TV Show,Eugenie Nights,,"Ameena Khalil, Zafer Abdeen, Injy El Mokkaddem, Khaled Kamal, Cherif Hafez, Carmen Bsaibes, Mourad Makram, Leila Ezz Al Arab, Asmaa Abou El Yazeed, Nadine Nassib Njeim",Egypt,"March 11, 2019",2018,1,"In 1940s Port Said, Kariman finds comfort and solace in the arms of an unhappily married man, who also happens to be her abusive husband's brother.",International TV
2035,s2036,TV Show,Eurovision Song Contest,,"Bar Refaeli, Erez Tal, Assi Azar, Lucy Ayoub",,"July 23, 2019",2019,1,Singers from all over Europe represent their countries in an international showdown and vie for superstar glory.,International TV
2044,s2045,TV Show,Ever After High,,"Jonquil Goode, Karen Strassman, Audu Paden, Julie Maddalena, Marieve Herington, Rena Strober, Evan Smith, Wendee Lee, Haviland Stillwell, Valerie Arem, Cam Clarke, Colleen Foy, Cindy Robinson, Joe Sanfelippo, Jamieson Price, Debi Derryberry, Lindsey Ames, Rajo Zakic, Erin Fitzgerald, Malcolm Danare",Canada,"August 6, 2020",2016,5,The kids of fairy-tale characters attend a school with two cliques: those who accept their fairy-tale destinies and those who want to write their own.,Kids
2048,s2049,TV Show,Everyday Miracles,,Mark Miodownik,United Kingdom,"August 1, 2017",2014,1,Materials scientist Mark Miodownik takes us into the world of everyday objects that make our lives more comfortable than those of our ancestors.,British TV
2050,s2051,TV Show,Everything Sucks!,,"Jahi Di'Allo Winston, Peyton Kennedy, Patch Darragh, Claudine Mboligikpelani Nako, Rio Mangini, Quinn Liebling, Sydney Sweeney, Elijah Stevenson, Zachary Ray Sherman, Abi Brittle",United States,"February 16, 2018",2018,1,"It's 1996 in a town called Boring, where high school misfits in the AV and drama clubs brave the ups and downs of teenage life in the VHS era.",TV Comedies
2051,s2052,TV Show,Evil,,"Katja Herbers, Mike Colter, Aasif Mandvi, Michael Emerson, Christine Lahti, Kurt Fuller, Marti Matulis",United States,"October 1, 2020",2019,1,A forensic psychologist partners with a Catholic priest-in-training to investigate miracles and demonic possession in this supernatural drama.,TV Dramas
2052,s2053,TV Show,Evil Genius,"Trey Borzillieri, Barbara Schroeder",,United States,"May 11, 2018",2018,1,This baffling true crime story starts with the grisly death of a pizza man who robs a bank with a bomb around his neck – and gets weirder from there.,Crime TV
2056,s2057,TV Show,Ex-Boyfriend,,"Tony Yang, Nana Lee, Jerry Huang, Liao Yi Chiao",China,"January 1, 2017",2011,1,"Still haunted by the traumatic event that ended her high school romance, a young professional gets a new subordinate: her former sweetheart.",International TV
2057,s2058,TV Show,Examination of Conscience,,,Spain,"January 25, 2019",2019,1,"Allegations of child sexual abuse in Spain's Catholic institutions are examined in interviews with survivors, clergy, journalists and other experts.",Crime TV
2058,s2059,TV Show,Exclusive Edition,James Lee,"Berg Lee, Yise Loo, Alvin Wong, Hady, Monday Kang, Ruobing, Wymen Yang, May June, Aenie Wong, Ernest Chong",,"August 14, 2017",2008,1,"Young journalists working for a magazine juggle careers, romance and other challenges while reporting on social issues and news stories in Malaysia.",International TV
2061,s2062,TV Show,Exhibit A,,,United States,"June 28, 2019",2019,1,This true crime series shows how innocent people have been convicted with dubious forensic techniques and tools such as touch DNA and cadaver dogs.,Crime TV
2068,s2069,TV Show,Explained,,,United States,"September 26, 2019",2019,2,"This enlightening series from Vox digs into a wide range of topics such as the rise of cryptocurrency, why diets fail, and the wild world of K-pop.",Docuseries
2072,s2073,TV Show,Extracurricular,,"Kim Dong-hee, Jung Da-bin, Park Ju-hyun, Nam Yoon-su, Choi Min-soo, Kim Yeo-jin, Park Hyuk-kwon",South Korea,"April 29, 2020",2020,1,A model high school student who's steeped in a world of serious crime finds his double life upended when a classmate takes an interest in his secret.,Crime TV
2073,s2074,TV Show,Extras,,"Ricky Gervais, Stephen Merchant, Ashley Jensen, Shaun Williamson, Shaun Pye",United Kingdom,"March 31, 2017",2006,2,"Grasping hungrily for stardom, bit actor Andy Millman and his pal Maggie spend their days chasing after work as film and TV extras.",British TV
2074,s2075,TV Show,Extreme Engagement,,"Tim Noonan, PJ Madam",,"July 12, 2019",2019,1,An engaged couple travels the world for a year to explore marriage customs in diverse cultures. Will the journey bring them closer or tear them apart?,International TV
2081,s2082,TV Show,Ezel,,"Kenan İmirzalıoğlu, Cansu Dere, Haluk Bilginer, Yiğit Özşener, Barış Falay, Burçin Terzioğlu, Bade İşçil, Sarp Akkaya, İpek Bilgin, Salih Kalyon, Tuncel Kurtiz, Sedef Avcı, Berrak Tüzünataç, İsmail Filiz",Turkey,"December 26, 2016",2009,1,A young man framed for a crime escapes a prison sentence by faking his own death and assuming a new identity as he seeks revenge.,Crime TV
2082,s2083,TV Show,海的儿子,,"Li Nanxing, Christopher Lee, Jesseca Liu, Apple Hong, Jeanette Aw",,"April 27, 2018",2016,1,"Two brothers start a new life in Singapore, where they run into a childhood friend who falls in love with the elder while attracting the younger.",International TV
2083,s2084,TV Show,F is for Family,,"Bill Burr, Laura Dern, Justin Long, Debi Derryberry, Sam Rockwell",United States,"June 12, 2020",2020,4,"Follow the Murphy family back to the 1970s, when kids roamed wild, beer flowed freely and nothing came between a man and his TV.",TV Comedies
2087,s2088,TV Show,Fabulous Lives of Bollywood Wives,,,India,"November 27, 2020",2020,1,"Cameras follow the banter and bonding between four fun-loving women from Bollywood’s inner circle as they juggle professions, family and friendship.",International TV
2090,s2091,TV Show,Fairy Tail,,"Tetsuya Kakihara, Aya Hirano, Rie Kugimiya, Yuichi Nakamura, Sayaka Ohara, Satomi Sato, Yui Horie, Hiroki Yasumoto, Ryoko Ono, Hiroki Touchi, Shinpachi Tsuji, Wataru Hatano, Mai Nakahara, Katsuyuki Konishi, Eri Kitamura, Todd Haberkorn, Cherami Leigh, Tia Lynn Ballard, Newton Pittman, Colleen Clinkenbeard, Brittney Karbowski, Jad Saxton, Christopher R. Sabat, Monica Rial, Rick Keeling, R. Bruce Elliott, David Wald, Brina Palencia, Patrick Seitz, Jamie Marchi",Japan,"April 1, 2017",2009,1,"When four young wizards team up to take jobs across the kingdom, they forge a bond more powerful than any magic and grow stronger with every mission.",Anime Series
2092,s2093,TV Show,Fake or Fortune?,,"Fiona Bruce, Philip Mould, Bendor Grosvenor",United Kingdom,"July 26, 2019",2015,1,Fiona Bruce and Philip Mould use investigative skills and scientific techniques to determine if paintings are real or just impressive forgeries.,British TV
2096,s2097,TV Show,Fall in Love with Me,,"Aaron Yan, Tia Lee, Jack Lee, Katherine Wang, Beatrice Fang, Vince Kao, Chen Bor Jeng",Taiwan,"October 1, 2016",2014,1,The head of a struggling ad agency finds herself torn between a hotshot executive and a kind stranger – not realizing they're the same person.,International TV
2098,s2099,TV Show,Fallet,,"Lisa Henni, Adam Godley, Tomas von Brömssen, Lia Boysen, Christoffer Nordenrot, Stina Rautelin, Erik Madsen, Magnus Krepper, Meliz Karlge, Linda Nilarve, Björn Granath, Richenda Carey, Dag Malmberg",Sweden,"April 1, 2018",2017,1,A Swedish detective and her timid British colleague's attempt to solve a gruesome murder case nets mixed results and miscommunication.,Crime TV
2100,s2101,TV Show,Falsa identidad,,"Luis Ernesto Franco, Camila Sodi, Sergio Goyri, Samadhi Zendejas, Eduardo Yáñez, Sonya Smith, Alejandro Camacho, Azela Robinson, Uriel del Toro, Géraldine Bazán, Gabriela Roel, Marcus Ornellas",Mexico,"June 1, 2019",2018,1,Strangers Diego and Isabel flee their home in Mexico and pretend to be a married couple to escape his drug-dealing enemies and her abusive husband.,Crime TV
2102,s2103,TV Show,Familiar Wife,,"Ji Sung, Han Ji-min, Kang Han-na, Jang Seung-jo",South Korea,"October 1, 2020",2018,1,"After receiving a bizarre chance to go back in time, a man wakes up to find that his whole life — including the person he married — is different.",International TV
2105,s2106,TV Show,Family Business,,"Jonathan Cohen, Gérard Darmon, Julia Piaton, Liliane Rovère, Olivier Rosemberg, Ali Marhyar, Lina El Arabi, Louise Coldefy, Enrico Macias, Valérie Damidot",France,"September 11, 2020",2020,2,"After learning France is about to legalize pot, a down-on-his-luck entrepreneur and his family race to turn their butcher shop into a marijuana café.",International TV
2106,s2107,TV Show,Family Reunion,,"Loretta Devine, Tia Mowry-Hardrict, Anthony Alabi, Talia Jackson, Isaiah Russell-Bailey, Cameron J. Wright, Jordyn Raya James, Richard Roundtree",United States,"January 20, 2020",2020,2,"When the McKellan family moves from Seattle to small-town Georgia, life down South – and traditional grandparents – challenge their big-city ways.",Kids
2112,s2113,TV Show,Fangbone,,"Taylor Abrahamse, Colin Doyle, Juan Chioran, Kathleen Laskey, Stacey DePass, Mike Kiss",Canada,"April 22, 2017",2016,1,"Magically transported from far-off Skullbania, a young barbarian teams up with an odd third-grader to protect his homeland from an evil sorcerer.",Kids
2116,s2117,TV Show,Fartsa,,"Alexander Petrov, Fillip Gorenshtein, Maksim Emelyanov, Aleksey Vesyolkin, Zoya Berber, Ieva Andrejevaite",Russia,"August 1, 2017",2015,1,"As four Russian friends grow up in the early '60s, life, love and the curse of success threaten to derail their dreams.",Crime TV
2117,s2118,TV Show,Fary : Hexagone,"Adrien Lagier, Ousmane Ly",Fary,France,"April 16, 2020",2020,2,"French comedy phenom Fary puts a playful spin on questions of identity, culture and more in the first half of an epic two-part stand-up special.",International TV
2120,s2121,TV Show,Fast & Furious Spy Racers,,"Tyler Posey, Charlet Chung, Jorge Diaz, Camille Ramsey, Luke Youngblood, Renée Elise Goldsberry",United States,"December 26, 2020",2020,3,A government agency recruits teen driver Tony Toretto and his thrill-seeking friends to infiltrate a criminal street racing circuit as undercover spies.,Kids
2121,s2122,TV Show,Fastest Car,,,United States,"September 20, 2019",2019,2,The drivers of exotic supercars put their street cred on the line against deceptively fast sleeper cars built and modified by true gearheads.,Reality TV
2124,s2125,TV Show,Fatal Destiny,,"Arucha Tosawat, Nappon Gomarachun, Phakin Khamwilaisak, Ratchawin Wongviriya, Penpak Sirikul, Saksit Tangtong",,"July 13, 2018",2016,1,A young man from a humble family is drawn into a life of crime – and soon confronts a determined cop in hot pursuit.,Crime TV
2125,s2126,TV Show,Fate/Apocrypha,,"Natsuki Hanae, Maaya Sakamoto, Kouki Uchiyama, Miyuki Sawashiro, Saori Hayami, Koji Yusa, Makoto Furukawa, Tetsu Inada, Satoshi Tsuruoka, Kei Shindou, Junichi Suwabe, Shunsuke Takeuchi, Ryotaro Okiayu, Mitsuru Miyamoto, Rumi Okubo, Ai Nonaka, Sakura Tange",Japan,"November 7, 2017",2017,2,The theft of the Greater Grail from Fuyuki City leads to a splintered timeline in which the Great Holy Grail War is waged on an unprecedented scale.,Anime Series
2126,s2127,TV Show,Fate/EXTRA Last Encore,,"Atsushi Abe, Sakura Tange, Kana Ueda, Hiroshi Kamiya, Noriko Shitaya, Kohsuke Toriumi, Urara Takano, Ai Nonaka, Kunihiko Yasui, Takahiro Mizushima",Japan,"October 30, 2018",2018,2,"Hakuno Kishinami finds himself in the midst of a Holy Grail war with no memories of how he got there. Through his confusion, he must fight to survive.",Anime Series
2128,s2129,TV Show,Fate/stay night: Unlimited Blade Works,,"Noriaki Sugiyama, Kana Ueda, Ayako Kawasumi, Junichi Suwabe, Noriko Shitaya, Mai Kadowaki, Masaki Terasoma, Nobutoshi Canna, Atsuko Tanaka, Shinichiro Miki, Yuu Asakawa, Miki Ito, Hiroshi Kamiya, Jouji Nakata, Tomokazu Seki",Japan,"December 20, 2018",2015,2,High school students Rin and Shiro pair up as allies when they're chosen to compete in a secret tournament for possession of the Holy Grail.,Anime Series
2129,s2130,TV Show,Fate/Zero,,"Rikiya Koyama, Ayako Kawasumi, Sayaka Ohara, Sho Hayami, Tomokazu Seki, Jouji Nakata, Akina Abe, Takumi Yamasaki, Hikaru Midorikawa, Daisuke Namikawa",Japan,"June 15, 2019",2012,2,"After three unsettled battles for the mystical Holy Grail, an artifact that grants a miracle to those who hold it, a fourth war begins.",Anime Series
2130,s2131,TV Show,Father Brown,Ian Barber,"Mark Williams, Sorcha Cusack, Nancy Carroll, Alex Price, Hugo Speer, Tom Chambers, Keith Osborn",United Kingdom," March 31, 2018",2017,6,"A modest, compassionate priest doubles as an effective crime solver in this series based on the short stories by G.K. Chesterton.",British TV
2134,s2135,TV Show,Fauda,,"Lior Raz, Hisham Suliman, Shadi Mar'i, Laëtitia Eïdo, Tsahi Halevi, Yuval Segal, Neta Garty, Tomer Kapon, Itzik Cohen, Rona-Lee Shim'on, Boaz Konforty, Doron Ben-David",Israel,"April 16, 2020",2020,3,"A top Israeli agent comes out of retirement to hunt for a Palestinian militant he thought he'd killed, setting a chaotic chain of events into motion.",Crime TV
2136,s2137,TV Show,Fear City: New York vs The Mafia,,,United States,"July 22, 2020",2020,1,"Five Mafia families ruled New York with a bloody fist in the 1970s and '80s, until a group of federal agents tried the unthinkable: taking them down.",Crime TV
2137,s2138,TV Show,Fear Files... Har Mod Pe Darr,,,India,"June 1, 2017",2015,1,"Possessed lovers, witches, haunted houses and more bring tales of horror to the screen in this anthology series.",International TV
2139,s2140,TV Show,Feel Good,Ally Pankiw,"Mae Martin, Charlotte Ritchie, Lisa Kudrow, Sophie Thompson, Tom Andrews, Tobi Bamtefa, Phil Burgers, Ophelia Lovibond, Adrian Lukis, Ritu Arya, Ramon Tikaram",United Kingdom,"March 20, 2020",2020,1,"Stand-up comic Mae Martin navigates a passionate, messy new relationship with her girlfriend, George, while dealing with the challenges of sobriety.",Romantic TV
2142,s2143,TV Show,Felipe Esparza: Bad Decisions,,Felipe Esparza,United States,"September 1, 2020",2020,1,"Two live performances, one in English and one in Spanish. No matter the language, Felipe Esparza is muy muy.",Stand-Up
2156,s2157,TV Show,Fifty: The Series,,"Ireti Doyle, Keira Hewatch, Dakore Akande, Omoni Oboli, Uzor Osimkpa, Wale Ojo, Timini Egbuson, Chris Attoh, Kachi Nnochiri",Nigeria,"February 7, 2020",2018,2,"Juggling careers and families, four ambitious women faced with unique crises weigh the consequences of their choices as they approach turning 50.",International TV
2158,s2159,TV Show,FIGHTWORLD,Padraic McKinley,Frank Grillo,,"October 12, 2018",2018,1,"Actor and fight enthusiast Frank Grillo travels the world, immersing himself in different fight cultures to understand their traditions and motivations.",Docuseries
2160,s2161,TV Show,Filinta,,"Onur Tuna, Serhat Tutumluer, Mehmet Özgür, Naz Elmas, Kayra Şenocak, Kamil Güler, Ceyhun Ergin, Burcu Çoban, Umut Kırcalı, Sencer Serta",Turkey,"April 15, 2017",2015,2,"In 19th-century Istanbul, a young police officer investigates crimes and falls in love with the daughter of a wealthy merchant conspiring against him.",Crime TV
2166,s2167,TV Show,FINAL FANTASY XIV Dad of Light,,"Yudai Chiba, Ren Osugi, Fumika Baba, Yoshihiko Hakamada, Hatsunori Hasegawa, Mako Ishino",Japan,"September 1, 2017",2017,1,A father and son rekindle their bond through the online role-playing game Final Fantasy XIV in this live-action series based on a true story.,International TV
2168,s2169,TV Show,Find Yourself,,,,"January 29, 2020",2020,1,"A determined entrepreneur navigates a love triangle between a young charmer and an older executive, leading her down an unconventional path to love.",International TV
2171,s2172,TV Show,Fire Chasers,,,United States,"September 8, 2017",2017,1,"As California's 2016 fire season rages, brave backcountry firefighters race to put out the flames, protect homes and save lives in this docuseries.",Docuseries
2176,s2177,TV Show,Fireman Sam,,"Steven Kynman, David Carling, Tegwen Tucker, Su Douglas, Andrew Hodwitz, Dave Pender, Lily Cassano, Carter Treneer, Sarah Lynn Strange",United Kingdom,"October 15, 2020",2018,4,"Sharing valuable lessons in fire safety for preschoolers, Fireman Sam and his animated crew from Pontypandy, Wales, are ready for any emergency.",British TV
2180,s2181,TV Show,First and Last,,,,"September 7, 2018",2018,1,Take an intimate look at the emotionally charged first and last days of new and soon-to-be released inmates at Georgia's Gwinnett County Jail.,Docuseries
2186,s2187,TV Show,First Team: Juventus,,,United States,"July 6, 2018",2018,2,Follow renowned soccer club Juventus on and off the pitch as they attempt to win a seventh straight Italian title and achieve Champions League glory.,Docuseries
2193,s2194,TV Show,Fit for Fashion,,Louise Roe,," December 14, 2018",2015,2,"In this reality series, physique meets fashion as contestants compete in challenges to transform both body and image for the grand prize of $100,000.",International TV
2196,s2197,TV Show,Five Came Back,Laurent Bouzereau,"Steven Spielberg, Guillermo del Toro, Lawrence Kasdan, Francis Ford Coppola, Paul Greengrass, Meryl Streep",United States,"March 31, 2017",2017,1,Five acclaimed contemporary directors tell the story of five legendary Hollywood filmmakers who enlisted in the armed forces to document World War II.,Docuseries
2199,s2200,TV Show,Fix It and Finish It,,Antonio Sabato Jr.,United States," July 20, 2018",2014,3,"A team of skilled contractors and designers hosted by Antonio Sabato Jr. renovates houses, cabins and even RVs, transforming properties in one day.",Reality TV
2201,s2202,TV Show,Flaked,,"Will Arnett, David Sullivan, Ruth Kearney, George Basil, Lina Esco, Travis Mills, Robert Wisdom, Mark Boone Junior, Matthew Willig, Heather Graham, Kirstie Alley, Sab Shimono, Christopher Mintz-Plasse, Minerva Garcia, Jeff Daniel Phillips",United States,"June 2, 2017",2017,2,"In his funky California beach enclave, Chip's the go-to guy for personal insights. But he isn't quite as enlightened when it comes to his own baggage.",TV Comedies
2203,s2204,TV Show,Flavorful Origins,,Yang Chen,China,"November 20, 2020",2020,3,"Delve into the delectable world of Chaoshan cuisine, explore its unique ingredients and hear the stories of the people behind its creation.",Docuseries
2206,s2207,TV Show,Flinch,,"Desiree Burch, Lloyd Griffith, Seann Walsh",United Kingdom,"May 3, 2019",2019,1,"Harrowing and hilarious tests await the brave and foolhardy, as well as the judges, in this comedy game show. If they flinch, they feel the pain.",Reality TV
2207,s2208,TV Show,Flint Town,,,United States,"March 2, 2018",2018,1,"Over a two-year period, filmmakers embedded with cops in Flint, Michigan, reveal a department grappling with volatile issues in untenable conditions.",Docuseries
2209,s2210,TV Show,Floor Is Lava,,Rutledge Wood,United States,"June 19, 2020",2020,1,"Teams compete to navigate rooms flooded with lava by leaping from chairs, hanging from curtains and swinging from chandeliers. Yes, really.",Reality TV
2210,s2211,TV Show,Flowering Heart,,"Choi Da-in, Yang Se-na, Gim Chae-eun, Esther, Um Sang-hyun, Shin Yong-woo",South Korea,"July 1, 2019",2016,1,"An ordinary student, who forms an advice club with her friends to help others, gains special powers after a mysterious encounter.",Kids
2211,s2212,TV Show,Flowers,,"Olivia Colman, Julian Barratt, Daniel Rigby, Sophia Di Martino, Leila Hoffman, Will Sharpe, Harriet Walter",United Kingdom,"December 15, 2018",2018,2,"Between a troubled marriage, a senile granny and twin siblings constantly in rivalry, a crumbling household struggles to barely keep it together.",British TV
2214,s2215,TV Show,Follow This,,"John Stanton, Scaachi Koul, Azeen Ghorayshi, Bim Adewunmi, Juliane Loffler, Charlie Warzel",United States,"November 1, 2018",2018,3,Follow the reporters at BuzzFeed as they probe topics ranging from quirky internet crazes to safe injection spaces for opioid users.,Docuseries
2215,s2216,TV Show,Followers,,"Miki Nakatani, Elaiza Ikeda, Mari Natsuki, Yuka Itaya, KOM_I, Mika Nakashima, Tadanobu Asano, Shuhei Uesugi, Nobuaki Kaneko, Hidekazu Mashima, Sho Kasamatsu, Yutaro",Japan,"February 27, 2020",2020,1,"When an aspiring actress hits it big thanks to a candid Instagram post, the lives of several Tokyo women cross as they struggle to define happiness IRL.",International TV
2217,s2218,TV Show,Food Wars!: Shokugeki no Soma,,"Yoshitsugu Matsuoka, Risa Taneda, Minami Takahashi, Shizuka Ishigami, Natsuki Hanae, Yuki Ono, Takahiro Sakurai, Ai Kayano, Maaya Uchida, Taishi Murata, Yusuke Kobayashi, Saori Onishi, Hisako Kanemoto, Chinatsu Akasaki, Nobuhiko Okamoto, Junichi Suwabe, Yuichi Nakamura, Jun Fukuyama",Japan,"October 1, 2020",2016,2,"Young chef Soma enters the prestigious Totsuki Culinary Academy, where he must emerge victorious in over-the-top cooking battles or face expulsion.",Anime Series
