,show_id,type,title,director,cast,country,date_added,release_year,duration,description,genre
3952,s3953,TV Show,Marseille,,"Gérard Depardieu, Benoît Magimel, Géraldine Pailhas, Nadia Farès, Stéphane Caillard, Jean-René Privat, Pascal Elso, Gérard Meylan",France,"February 23, 2018",2018,2,The longtime mayor of Marseille is preparing to hand over the reins to his protégé when a sudden and ruthless battle erupts for control of the city.,International TV
3959,s3960,TV Show,Marvel Anime: Wolverine,,"Rikiya Koyama, Romi Park, Fumiko Orikasa, Hidekatsu Shibata, Kazuki Yao, Masato Hagiwara",United States,"December 16, 2020",2011,1,"Logan, aka mutant X-Man Wolverine, is on a quest to reclaim the love of his life – whose crime lord father is planning an arranged marriage for her.",Anime Series
3960,s3961,TV Show,Marvel Anime: X-Men,,"Toshiyuki Morikawa, Rikiya Koyama, Katsunosuke Hori, Aya Hisakawa, Kaori Yamagata, Yoshiko Sakakibara, Yurika Hino, Yukari Tamura, Hideyuki Tanaka",Japan,"December 16, 2020",2011,1,"A year after their dissolution, the X-Men are re-assembled by Professor Charles Xavier to investigate the kidnapping of young mutants in Japan.",Anime Series
3962,s3963,TV Show,Marvel's Agents of S.H.I.E.L.D.,,"Clark Gregg, Ming-Na Wen, Brett Dalton, Chloe Bennet, Iain De Caestecker, Elizabeth Henstridge, Adrianne Palicki, Luke Mitchell, Henry Simmons",United States,"October 30, 2020",2020,7,"Agent Phil Coulson, seen in action in Marvel's The Avengers, assembles a team of top S.H.I.E.L.D. agents to investigate bizarre threats.",TV Action
3963,s3964,TV Show,Marvel's Daredevil,,"Charlie Cox, Deborah Ann Woll, Elden Henson, Rosario Dawson, Vincent D'Onofrio, Jon Bernthal, Elodie Yung, Scott Glenn, Stephen Rider, Vondie Curtis-Hall, Ayelet Zurer, Toby Leonard Moore, Bob Gunton",United States,"October 19, 2018",2018,3,"Blinded as a young boy, Matt Murdock fights injustice by day as a lawyer and by night as the Super Hero Daredevil in Hell's Kitchen, New York City.",Crime TV
3965,s3966,TV Show,Marvel's Iron Fist,,"Finn Jones, Jessica Henwick, David Wenham, Jessica Stroup, Tom Pelphrey",United States,"September 7, 2018",2018,2,"Danny Rand resurfaces 15 years after being presumed dead. Now, with the power of the Iron Fist, he seeks to reclaim his past and fulfill his destiny.",Crime TV
3967,s3968,TV Show,Marvel's Jessica Jones,,"Krysten Ritter, David Tennant, Rachael Taylor, Mike Colter, Carrie-Anne Moss, Eka Darville, Erin Moriarty, Wil Traval, Susie Abromeit",United States,"June 14, 2019",2019,3,"Haunted by a traumatic past, Jessica Jones uses her gifts as a private eye to find her tormentor before he can harm anyone else in Hell's Kitchen.",Crime TV
3968,s3969,TV Show,Marvel's Luke Cage,,"Mike Colter, Alfre Woodard, Rosario Dawson, Simone Missick, Mahershala Ali, Erik LaRay Harvey, Theo Rossi, Frank Whaley, Frankie Faison, Sonia Braga, Ron Cephas Jones",United States,"June 22, 2018",2018,2,"A hoodie-wearing, unbreakable ex-con fights to clear his name and save his neighborhood. He wasn't looking for a fight, but the people need a hero.",Crime TV
3969,s3970,TV Show,Marvel's The Defenders,,"Charlie Cox, Krysten Ritter, Mike Colter, Finn Jones, Sigourney Weaver, Elodie Yung, Elden Henson, Jessica Henwick, Simone Missick, Rachael Taylor, Deborah Ann Woll, Rosario Dawson, Carrie-Anne Moss, Eka Darville, Scott Glenn",United States,"August 18, 2017",2017,1,"Daredevil, Jessica Jones, Luke Cage and Iron Fist join forces to take on common enemies as a sinister conspiracy threatens New York City.",Crime TV
3970,s3971,TV Show,Marvel's The Punisher,,"Jon Bernthal, Ebon Moss-Bachrach, Ben Barnes, Amber Rose Revah, Jason R. Moore, Daniel Webber, Jaime Ray Newman, Michael Nathanson, Deborah Ann Woll, Paul Schulze",United States,"January 18, 2019",2019,2,A former Marine out to punish the criminals responsible for his family's murder finds himself ensnared in a military conspiracy.,Crime TV
3974,s3975,TV Show,Mary Portas: Secret Shopper,,Mary Portas,United Kingdom,"July 26, 2019",2016,1,Retail consultant Mary Portas collaborates with Britain's most complained-about stores to help them better serve fed-up customers.,British TV
3975,s3976,TV Show,Masaba Masaba,,"Masaba Gupta, Neena Gupta, Neil Bhoopalam, Rytasha Rathore, Smaran Sahu, Nayan Shukla, Pooja Bedi, Satyadeep Misra",India,"August 28, 2020",2020,1,"Real life mom-daughter duo Neena and Masaba Gupta play versions of themselves in this playful, fictional peek into their lives in fashion and film.",International TV
3977,s3978,TV Show,Masameer Classics,,"Malik Nejer, Abdulaziz Alshehri",Saudi Arabia,"December 9, 2020",2013,4,"Through dark comedy and eccentric characters, this web series offers a humorous view of the changes and cultural shifts in Saudi Arabia from 2011-2019.",International TV
3979,s3980,TV Show,Masha and the Bear,,"Alina Kukushkina, Boris Kutnevich, Giselle Nieto, Elsie Fisher",Russia,"May 1, 2020",2019,4,"Lively little Masha lives near the forest, where she has many wonderful adventures with her best friend, a bear who used to be in the circus.",Kids
3980,s3981,TV Show,Masha's Spooky Stories,,,United States,"October 1, 2016",2012,1,"Masha explains why there's no need to be scared of things like monsters, the dark, going to a new school, thunder and other common childhood fears.",Kids
3981,s3982,TV Show,Masha's Tales,,,,"February 1, 2016",2012,1,"Fairy tales get a funny twist when Masha retells them, because she tends to get the details just a little jumbled up in this animated kids' series.",Kids
3985,s3986,TV Show,Master of None,,"Aziz Ansari, Noël Wells, Eric Wareheim, Lena Waithe, Kelvin Yu, Fatima Ansari, Shoukath Ansari, Alessandra Mastronardi, Bobby Cannavale",United States,"May 12, 2017",2017,2,Dev tries to jump-start his acting career and elevate his dating game with help from his eclectic group of friends in this award-winning series.,TV Comedies
4009,s4010,TV Show,MeatEater,,Steven Rinella,United States,"September 16, 2020",2020,3,Steven Rinella scrounges in some of America's wildest terrains in this unscripted series showing him on the hunt for wild animals from ducks to deer.,Docuseries
4010,s4011,TV Show,Medal of Honor,,"Oliver Hudson, Ben Schwartz, Paul Wesley, Aldis Hodge, Jonny Weston, Joseph Cross, Jake Abel, Derek Mio",United States,"November 9, 2018",2018,1,"Honoring service members whose courage merited the awarding of a Medal of Honor, this docudrama series re-creates their inspiring true stories.",Docuseries
4011,s4012,TV Show,Medical Police,,"Erinn Hayes, Rob Huebel, Malin Akerman, Rob Corddry, Lake Bell, Sarayu Blue, Ken Marino, Fred Melamed, Tom Wright, Jason Schwartzman, Eric Nenninger, Megan Le, Beth Dover, Zandy Hartig, Brian Huskey, Michael Cera",United States,"January 10, 2020",2020,1,Doctors Owen Maestro and Lola Spratt leave Childrens Hospital and join a secret arm of the CDC to investigate and destroy a deadly global virus.,Crime TV
4012,s4013,TV Show,Medici: Masters of Florence,,"Richard Madden, Dustin Hoffman, Stuart Martin, Annabel Scholey",Italy,"May 1, 2020",2019,3,"After his father's murder, banking heir Cosimo Medici battles opponents of his artistic, economic and political visions for 15th-century Florence.",International TV
4015,s4016,TV Show,Meet the Adebanjos,,"Wale Ojo, Yetunde Oduwole, Andrea Aboagye, Daniel Davids, Moji Bamtefa, Jordan Coulson",United Kingdom,"November 4, 2019",2016,3,"In South London, tradition clashes with culture as a Nigerian father tries to instill his old-fashioned African values into his modern British family.",British TV
4018,s4019,TV Show,Mega Food,,,United Kingdom,"July 12, 2019",2013,1,"Visiting the busiest kitchens in the world, this reality series focuses on large-scale food production – and the people who make it happen.",British TV
4019,s4020,TV Show,Megalobox,,"Yoshimasa Hosoya, Shiro Saito, Hiroki Yasumoto, Nanako Mori, Michiyo Murase, Hiroyuki Kinoshita",Japan,"June 1, 2020",2018,1,"Created for the 50th anniversary of manga ""Ashita No Joe,"" mechanized human fighters known as Megalo Boxers battle each other for boxing supremacy.",Anime Series
4020,s4021,TV Show,MegaTruckers,,,Australia,"July 12, 2019",2012,1,"This reality ride-along offers a glimpse into the can-do, high-stakes world of big rig drivers who haul massive loads of cargo across Australia.",Reality TV
4024,s4025,TV Show,Melodies of Life - Born This Way,,,,"June 21, 2019",2016,1,"A celebrated pastry chef and his fellow staff members at a bake shop embark on bittersweet adventures in love, work and friendship.",International TV
4028,s4029,TV Show,Memories of the Alhambra,,"Hyun Bin, Park Shin-hye, Park Hoon, Kim Yong-rim, Chanyeol, Lee Re, Lee Hak Joo, Lee Si-won, Kim Eui-sung",South Korea,"December 2, 2018",2018,1,"While looking for the cryptic creator of an innovative augmented-reality game, an investment firm executive meets a woman who runs a hostel in Spain.",Crime TV
4030,s4031,TV Show,Memory Love,,"Andy Chen, Mandy Wei, Jolin Chien, Mandy Tao, Kris Shen, Nylon Chen",,"January 18, 2019",2017,1,"Losing her memory – and her boyfriend – after a car accident, Jia-en crosses paths with a heart transplant recipient who helps her recall her past.",International TV
4033,s4034,TV Show,Men on a Mission,Jung-ah Im,"Ho-dong Kang, Soo-geun Lee, Sang-min Lee, Young-chul Kim, Jang-hoon Seo, Hee-chul Kim, Kyung-hoon Min",South Korea,"August 10, 2020",2020,5,"Male celebs play make-believe as high schoolers, welcoming star transfer students every week and engaging in battles of witty humor and slapstick.",International TV
4043,s4044,TV Show,Mere Papa Hero Hiralal,,"Sarwar Ahuja, Riva Arora",,"May 1, 2018",2018,1,"A simple auto-rickshaw driver on the streets of Lucknow, Hiralal Tiwari does everything he can to give his gravely ill daughter a happy life.",International TV
4046,s4047,TV Show,Merlí,,"Francesc Orella, David Solans, Candela Antón, Albert Baró, Adrian Grösser, Marcos Franz, Pau Poch, Júlia Creus, Carlos Cuevas, Elisabet Casanovas, Iñaki Mur, Pau Durà, Pere Ponce, Mar del Hoyo, Rubén de Eguia, Patrícia Bargalló, Assun Planas, Pep Jové, Anna Maria Barbany, Marta Marco, Jordi Martínez, Victòria Pagès, Marta Domingo, Anna Ycobalzeta, Oriol Pla, Pepa López",Spain,"December 1, 2016",2015,1,"An unconventional high school philosophy teacher upsets a few parents and staff, romances others and inspires all his pupils, including his gay son.",International TV
4047,s4048,TV Show,Merlin,James Hawes,"Colin Morgan, Bradley James, Katie McGrath, Angel Coulby, Richard Wilson, Anthony Head, John Hurt, Nathaniel Parker",United Kingdom,"December 15, 2016",2012,5,"This family-oriented retelling of the King Arthur legend finds Merlin arriving in Camelot, where he hones his magic skills with the help of his uncle.",British TV
4048,s4049,TV Show,Merry Happy Whatever,,"Dennis Quaid, Bridgit Mendler, Brent Morin, Ashley Tisdale, Siobhan Murphy, Adam Rose, Elizabeth Ho, Hayes MacArthur, Garcelle Beauvais, Tyler Ritter, Mason Davis, Lucas Jaye",United States,"November 28, 2019",2019,1,"A struggling LA musician tries to win over his new girlfriend's gruff dad and quirky, tight-knit siblings on a 10-day Christmas visit to Philadelphia.",TV Comedies
4053,s4054,TV Show,Messiah,,"Michelle Monaghan, Mehdi Dehbi, John Ortiz, Tomer Sisley, Melinda Page Hamilton, Stefania LaVie Owen, Sayyid El Alami, Jane Adams, Wil Traval, Fares Landoulsi",United States,"January 1, 2020",2020,1,A wary CIA officer investigates a charismatic man who sparks a spiritual movement and stirs political unrest. A fictional story not based on true events.,TV Dramas
4055,s4056,TV Show,Metallica: Some Kind of Monster,"Joe Berlinger, Bruce Sinofsky","James Hetfield, Lars Ulrich, Kirk Hammett, Robert Trujillo",United States,"February 10, 2017",2014,1,"This collection includes the acclaimed rock documentary about Metallica, plus a film checking in with the still-thriving group 10 years later.",TV Shows
4056,s4057,TV Show,Meteor Garden,,"Shen Yue, Dylan Wang, Darren Chen, Connor Liang, Caesar Wu",China,"July 14, 2018",2018,1,"Dong Shancai is determined to excel at her dream university, where she encounters an elite clique of dashing, popular high-achievers – and finds love.",International TV
4059,s4060,TV Show,Mexico Diseña,,,United States,"February 1, 2017",2016,1,Young fashion designers vie for the chance to become Mexico's next big talent by competing before judges in grueling tests of creativity and stamina.,International TV
4065,s4066,TV Show,Mia and Me,,"Rosabell Laurenti Sellers, Adrian Moore, Saphia Stoney, Josephine Benini, Andrew Craig, Tajja Isen, Rod Wilson, Linda Ballantyne, Jonathan Wilson, Elizabeth Hanna, Norma Dell'Agnese",Netherlands,"January 1, 2020",2017,2,"A mysterious gift from her late parents sends 12-year-old Mia into an enchanted world of elves, unicorns and an evil queen named Panthea.",Kids
4075,s4076,TV Show,Middleditch & Schwartz,Ryan Polito,"Thomas Middleditch, Ben Schwartz",United States,"April 21, 2020",2020,1,Comedy duo Thomas Middleditch and Ben Schwartz turn small ideas into epically funny stories in this series of completely improvised comedy specials.,TV Comedies
4077,s4078,TV Show,Midnight Diner,,"Kaoru Kobayashi, Toshiki Ayata, Mansaku Fuwa, Yutaka Matsushige, Ken Mitsuishi, Shohei Uno, Takashi Yamanaka, Kiyofumi Kaneko, Risa Sudou, Asako Kobayashi, Nahoko Yoshimoto, Joe Odagiri",Japan,"June 1, 2020",2014,3,"A scarred man operates a midnight diner in the backstreets of Shinjuku. No one knows his name or his story, but his customers each bring him theirs.",International TV
4078,s4079,TV Show,Midnight Diner: Tokyo Stories,,"Kaoru Kobayashi, Joe Odagiri, Mansaku Fuwa, Reiko Kataoka, Koen Kondo, Bsaku Sato, Hirofumi Arai, Mamiko Itoh, Yuma Yamoto, Yoshinori Okada, Ah-sung Ko, Kosuke Toyohara, Yoshiyuki Morishita, Junko Miyashita, Tamaki Ogawa, Toru Kazama, Kotaro Shiga, Mitsuru Hirata, Toshiki Ayata, Shohei Uno, Tamae Ando, Risa Sudou, Asako Kobayashi, Takashi Yamanaka, Yutaka Matsushige, Ken Mitsuishi, Mikako Tabe, Kimiko Yo",Japan,"October 31, 2019",2019,2,Patrons of an otherwise mundane Japanese diner find simple yet profound connections with one another based on the shared love of a particular dish.,International TV
4079,s4080,TV Show,Midnight Misadventures With Mallika Dua,,Mallika Dua,India,"April 1, 2019",2018,1,"In this talk show, comedian Mallika Dua serves up big laughs as Shalishka and whips up a meal with her celebrity pals who dish on their diets and lives.",International TV
4081,s4082,TV Show,Mighty Express,,"Jay Hatton, Zoe Hatz, Meesha Contreras, Dylan Shombing, Tyler Nathan, Leo Orgil, Michela Luci, Ian Ho, Evan Lefeuvre, Annick Obonsawin",United States,"September 22, 2020",2020,1,Catch a ride with the Mighty Express — a team of trains and their kid friends who overcome trouble on the tracks with quick thinking and teamwork!,Kids
4083,s4084,TV Show,Mighty Little Bheem,,,,"September 25, 2020",2020,3,An innocent toddler’s boundless curiosity – and extraordinary might – lead to mischief and adventure in his small Indian town.,Kids
4084,s4085,TV Show,Mighty Little Bheem: Diwali,,"Samriddhi Shukla, Nishka Raheja, Arannya Kaur, Shanoor Mirza, Rajesh Kava",India,"October 18, 2019",2019,1,"From decorating his home to devouring sweets, join Bheem as he makes merry – and a bit of mischief – while the festival of lights is in full swing.",Kids
4085,s4086,TV Show,Mighty Little Bheem: Festival of Colors,,"Samruddhi Shukla, Aranya Kaur, Rajesh Kava, Nishka Raheja, Sabina Malik, Shanoor Mirza",India,"March 5, 2020",2020,1,"From surprising stage performances to spraying colors with friends, join baby Bheem for all his Holi hijinks during the special spring festival.",Kids
4086,s4087,TV Show,Mighty Little Bheem: Kite Festival,,"Sumruddhi Shukla, Aranya Kaur, Nishka Raheja",India,"January 8, 2021",2021,1,"With winter behind them, Bheem and his townspeople usher in a sunny new season in all their favorite ways during the Makar Sankranti festival.",Kids
4087,s4088,TV Show,Mighty Morphin Alien Rangers,,"Julia Jordan, Matthew Sakimoto, Sicily Johnson, Michael O'Laskey II, Michael R. Gotto, Justin Timsit, Rajia Baroudi, David Bacon, Jim Gray, Karim Prince, Alan Palmer, Tom Wyner, Barbara Goodson, Robert Axelrod, Kerrigan Mahan",,"January 1, 2016",1996,1,Visitors arrive from space to help Red Ranger and his squad – temporarily stripped of their powers – fight against Lord Zedd and Rita Repulsa.,Kids
4088,s4089,TV Show,Mighty Morphin Power Rangers,,"Austin St. John, Thuy Trang, Walter Jones, Amy Jo Johnson, David Yost, Jason David Frank, Johnny Yong Bosch, Karan Ashley, Steve Cardenas, Catherine Sutherland, Paul Schrier, Jason Narvy, David Fielding, Richard Steven Horvitz, Barbara Goodson",United States,"January 1, 2016",2010,4,"Five average teens are chosen by an intergalactic wizard to become the Power Rangers, who must use their new powers to fight the evil Rita Repulsa.",Kids
4102,s4103,TV Show,Millennials,,"Nicolás Riera, Laura Laprida, Juan Manuel Guilera, Johanna Francella, Matías Meyer, Noelia Marzol, Luisa Drozdek, Agustina Mindlin, Santiago Talledo, Chang Sung Kim, Osmar Nuñez, Fabio Aste",Argentina,"November 5, 2019",2019,2,A group of millennials copes with the pressures of adulting by tackling a diverse set of problems from unemployment to cheating.,International TV
4103,s4104,TV Show,Million Dollar Beach House,,,United States,"August 26, 2020",2020,1,The competition is fierce — and the drama undeniable — as a group of young and hungry agents try to seal the deal on luxury listings in the Hamptons.,Reality TV
4104,s4105,TV Show,Million Pound Menu,,,United Kingdom,"August 27, 2019",2019,2,Next-gen restaurateurs get the chance to open their own pop-up eateries to impress the paying public – and a panel of discerning U.K. investors.,British TV
4105,s4106,TV Show,Million Yen Women,,"Yojiro Noda, Rila Fukushima, Rena Matsui, Miwako Wagatsuma, Rena Takeda, Yuko Araki, Yuya Endo, Kaito Yoshimura, Moeka Hoshi, Juri Ihata, Mariko Tsutsui, Kanji Furutachi, Tetsuhiro Ikeda, Takashi Yamanaka, Tomoya Nakamura, Lily Franky",Japan,"August 15, 2017",2017,1,"Five beautiful but mysterious women move in with unsuccessful novelist Shin, who manages their odd household in exchange for a tidy monthly sum.",Crime TV
4106,s4107,TV Show,Mind Game,,"Tay Ping Hui, Joanne Peh, Zhang Yaodong, Paige Chua, Akit Tay",Singapore,"June 1, 2017",2015,1,"With the help of a cop, a psychologist and a woman who can foretell the future, a brilliant paralegal works to solve an array of perplexing mysteries.",Crime TV
4109,s4110,TV Show,MINDHUNTER,,"Jonathan Groff, Holt McCallany, Anna Torv, Cotter Smith, Hannah Gross",United States,"August 16, 2019",2019,2,In the late 1970s two FBI agents expand criminal science by delving into the psychology of murder and getting uneasily close to all-too-real monsters.,Crime TV
4112,s4113,TV Show,Minecraft: Story Mode,,"Patton Oswalt, Catherine Taber, Sean Astin, Melissa Hutchison, Ashley Johnson, Matthew Mercer, Jim Meskimen, Martha Plimpton, Scott Porter, Brian Posehn, Paul Reubens, Billy West, Dave Fennoy",United States,"November 27, 2018",2015,1,"Take control of an adventure set in the Minecraft universe. The future of the world is at stake, and your decisions shape the story – so choose wisely!",Kids
4113,s4114,TV Show,Mini Wolf,,,France," September 16, 2018",2014,2,Mini-Wolf and his fun-loving pals friends are always on the look out for a new adventure – even if it includes a little bit of mischief.,Kids
4114,s4115,TV Show,Miniforce,,"Sang-hyun Um, Jeong-hwa Yang, Tae-yeol Jeon, Yong-woo Shin, So-yeong Lee, Wan-kyung Sung, Soyeon, Jin-wook Hong, Yeong-wung Jeong",,"June 1, 2017",2016,1,Four animal superheroes called the Miniforce transform into robots to protect small and defenseless creatures from the hands of scheming villains.,Kids
4115,s4116,TV Show,Miniforce X,,,South Korea,"October 1, 2019",2018,1,Zenos wants to use the Earth’s negative energy for his own good – and it's up to Miniforce X to stop this space alien’s evil plans.,Kids
4118,s4119,TV Show,Minute to Win It,,Apolo Anton Ohno,United States,"December 15, 2018",2013,1,"In this game show hosted by Olympian Apolo Anton Ohno, contestants compete by completing 60-second challenges using common household items.",Reality TV
4121,s4122,TV Show,Miraculous: Tales of Ladybug & Cat Noir,Thomas Astruc,"Cristina Vee, Bryce Papenbrook, Keith Silverstein, Mela Lee, Max Mittelman, Carrie Keranen, Stephanie Sheh, André Gordon, Matthew Mercer, Christopher Corey Smith, Philece Sampler, Selah Victor, Marieve Herington, Ben Diskin, Kira Buckland, Erin Fitzgerald, Grant George, Ethan Murray, David Roach, Todd Haberkorn",France,"February 1, 2020",2019,5,"When Paris is in peril, Marinette becomes Ladybug. Little does she know, her school crush Adrien is actually Cat Noir, another city-saving superhero.",Kids
4127,s4128,TV Show,Misaeng,,"Im Si-wan, Kang So-ra, Lee Sung-min, Kang Ha-neul, Byun Yo-han, Kim Dae-myeong, Shin Eun-jung, Park Hae-joon",South Korea,"August 8, 2019",2014,1,"Equipped with nothing more than a GED and strategies for the game of go, an office intern gets thrown into the cold reality of the corporate world.",International TV
4131,s4132,TV Show,Mismatched,,"Prajakta Koli, Rohit Saraf, Vihaan Samat, Taaruk Raina, Vidya Malavade, Kritika Bharadwaj, Rannvijay Singh, Muskkaan Jaferi, Devyani Shorey, Suhasini Mulay, Abhinav Sharma, Ravin Makhija",India,"November 20, 2020",2020,1,"After a disastrous set-up by their families, two teens strike up a tentative friendship at their summer program — but deeper feelings aren’t far behind.",International TV
4133,s4134,TV Show,Miss Culinary,,"Wanida Termthanaporn, Jason Young, Thanawin Teeraphosukarn, Thanabordee Jaiyen, Chonnikan Netjui, Passaranan Ussadamongkol, Janya Thanasawangkun, Jaturong Mokjok, Panadda Wongphudee️️",,"November 19, 2019",2019,1,"After ditching her domestic life to become a chef, a clueless maid crosses paths with two charming suitors who help her reach her dreams.",International TV
4134,s4135,TV Show,Miss Dynamite,,"Camila Sodi, Iván Sánchez, José María de Tavira, Hugo Stiglitz, José Sefami, Mauricio Isaac, Paulina Gaitán, Mara Cuevas, Mario Zaragoza, Alejandro Durán, Emilio Savinni, Pakey Vázquez, Anilú Pardo, Claudette Maillé, Rodrigo Murray, Camila Selser, Saúl Lisazo, Eréndira Ibarra",Mexico,"May 5, 2018",2015,1,"Wealthy, beautiful Valentina falls in love, only to realize that her man and her family are involved with one of Mexico's most powerful drug cartels.",Crime TV
4136,s4137,TV Show,Miss in Kiss,,"Esther Wu, Dino Lee, Gong Yi Teng, Xi Wei Lun, Honduras, Vega Tsai, Shen Chang Hung",Taiwan,"December 8, 2016",2016,1,"A quirk of fate sends an ordinary, sweet-natured high school girl and her father into the home of the school genius, on whom she has a huge crush.",International TV
4141,s4142,TV Show,Miss Panda & Mr. Hedgehog,,"Dong-hae Lee, Seung-ah Yoon, Jin-hyuk Choi, So-young Yoo, Yeo-jin Hong, Min-jin Jung",South Korea,"December 15, 2016",2012,1,"When a gifted patissier with a gloomy past meets a bright and easygoing café owner, he begins to shed his thorns and learns to love again.",International TV
4143,s4144,TV Show,Miss Rose,,"Roy Chiu, Megan Lai, Paul Hsu, Tia Lee, Chunya Chao, Puff Kuo, Blaire Chang",Taiwan,"August 1, 2016",2015,1,"Resolving to get married soon, hardworking Si-yi finds love in an unexpected place, but her ex and her job interfere with her plans.",International TV
4156,s4157,TV Show,Mob Psycho 100,,"Tatsuomi Hamada, Kazuki Namioka, Yuki Yoda, Ayumu Mochizuki, Atsushi Arai, Akio Otsuka, Moro Morooka",Japan,"May 22, 2018",2018,1,"There's an organization gathering espers for a nefarious purpose. Powerful psychic Mob, however, is just trying to be the protagonist of his own life.",International TV
4157,s4158,TV Show,Mobile Suit Gundam UC,,"Kouki Uchiyama, Ayumi Fujimura, Hiro Shimono, Haruka Tomatsu, Daisuke Namikawa, Megumi Toyoguchi, Yuhko Kaida, Shuichi Ikeda, Tetsuya Kakihara",Japan,"September 20, 2018",2014,1,"When Banagher Links meets the mysterious Audrey Burne, he inherits the Unicorn Gundam and is swept up into the battle for space colony independence.",Anime Series
4158,s4159,TV Show,Mobile Suit Gundam: Iron-Blooded Orphans,,"Kengo Kawanishi, Yoshimasa Hosoya, Natsuki Hanae, Yuuichirou Umehara, Yasuaki Takumi, Taishi Murata, Kouhei Amasaki, Mutsumi Tamura, Soma Saito, Yuka Terasaki, Hisako Kanemoto, Takahiro Sakurai, Masaya Matsukaze, Toru Okawa",Japan,"November 1, 2019",2016,2,"On a terraformed post-disaster Mars, a group of child security agents rebel against the adults who betrayed them and the oppressive Earth government.",Anime Series
4160,s4161,TV Show,Moesha,,"Brandy Norwood, William Allen Young, Sheryl Lee Ralph, Countess Vaughn, Lamont Bentley, Shar Jackson, Marcus T. Paulk, Yvette Wilson",United States,"August 1, 2020",2000,6,"Navigating the twists and firsts of high school, Moesha juggles friendships, romance and the occasional drama while trying to keep her family together.",TV Comedies
4167,s4168,TV Show,Molang,,Bruno Guéraçague,France,"July 1, 2019",2015,1,"An imaginative, big-hearted bunny and his friend, a shy chick, explore the everyday joys of their pastel-colored world.",Kids
4170,s4171,TV Show,Momo Salon,,"Lizzy, Jung-min Park, Sang-hee Lee",South Korea,"July 1, 2017",2014,1,"An aspiring hair stylist opens her own salon. It turns into a mail-holding hub for busy neighbors, but she seizes the chance to promote her business.",International TV
